"ID","Polymer Composition","Entry Title","Release Date","Resolution (Å)","Method"
"3KLE","Protein/DNA","Crystal structure of AZT-resistant HIV-1 Reverse Transcriptase crosslinked to a DSDNA with a bound excision product, AZTPPPPA","2010-09-22","3.2","X-ray"
"3KLF","Protein/DNA","Crystal structure of wild-type HIV-1 Reverse Transcriptase crosslinked to a DSDNA with a bound excision product, AZTPPPPA","2010-09-22","3.1","X-ray"
"3KLG","Protein/DNA","Crystal structure of AZT-resistant HIV-1 Reverse Transcriptase crosslinked to pre-translocation AZTMP-Terminated DNA (COMPLEX N)","2010-09-22","3.6","X-ray"
"3KLH","Protein/DNA","Crystal structure of AZT-Resistant HIV-1 Reverse Transcriptase crosslinked to post-translocation AZTMP-Terminated DNA (COMPLEX P)","2010-09-22","2.9","X-ray"
"3KMD","Protein/DNA","Crystal structure of the p53 core domain bound to a full consensus site as a self-assembled tetramer","2010-02-23","2.1","X-ray"
"3KMP","Protein/DNA","Crystal Structure of SMAD1-MH1/DNA complex","2010-02-23","2.7","X-ray"
"3KNT","Protein/DNA","Crystal structure of Methanocaldococcus jannaschii 8-oxoguanine glycosylase/lyase in complex with 15mer DNA containing 8-oxoguanine","2010-02-02","2.7","X-ray"
"3KO2","Protein/DNA","I-MsoI re-designed for altered DNA cleavage specificity (-7C)","2010-05-19","2.9","X-ray"
"3KOV","Protein/DNA","Structure of MEF2A bound to DNA reveals a completely folded MADS-box/MEF2 domain that recognizes DNA and recruits transcription co-factors","2010-02-16","2.9","X-ray"
"3KQH","Protein/DNA","Three Conformational Snapshots of the Hepatitis C Virus NS3 Helicase Reveal a Ratchet Translocation Mechanism","2010-01-26","2.4","X-ray"
"3KQK","Protein/DNA","Three Conformational Snapshots of the Hepatitis C Virus NS3 Helicase Reveal a Ratchet Translocation Mechanism","2010-01-26","2.8","X-ray"
"3KQL","Protein/DNA","Three Conformational Snapshots of the Hepatitis C Virus NS3 Helicase Reveal a Ratchet Translocation Mechanism","2010-01-26","2.5","X-ray"
"3KQN","Protein/DNA","Three Conformational Snapshots of the Hepatitis C Virus NS3 Helicase Reveal a Ratchet Translocation Mechanism","2010-01-26","2.0","X-ray"
"3KQU","Protein/DNA","Three Conformational Snapshots of the Hepatitis C Virus NS3 Helicase Reveal a Ratchet Translocation Mechanism","2010-01-26","2.4","X-ray"
"3KSA","Protein/DNA","Detailed structural insight into the DNA cleavage complex of type IIA topoisomerases (cleaved form)","2010-05-05","3.3","X-ray"
"3KSB","Protein/DNA","Detailed structural insight into the DNA cleavage complex of type IIA topoisomerases (re-sealed form)","2010-05-05","3.5","X-ray"
"3KTQ","Protein/DNA","CRYSTAL STRUCTURE OF AN ACTIVE TERNARY COMPLEX OF THE LARGE FRAGMENT OF DNA POLYMERASE I FROM THERMUS AQUATICUS","1999-01-13","2.3","X-ray"
"3KTU","Protein/DNA","Structure of human 8-oxoGuanine Glycosylase 1 bound to fluorninated oxoG-containing DNA","2010-07-14","2.3","X-ray"
"3KUY","Protein/DNA","DNA Stretching in the Nucleosome Facilitates Alkylation by an Intercalating Antitumor Agent","2010-01-05","2.9","X-ray"
"3KWQ","Protein/DNA","Structural characterization of H3K56Q nucleosomes and nucleosomal arrays","2010-05-12","3.5","X-ray"
"3KXB","Protein/DNA","Structural characterization of H3K56Q nucleosomes and nucleosomal arrays","2010-06-23","3.2","X-ray"
"3KXT","Protein/DNA","Crystal structure of Sulfolobus Cren7-dsDNA complex","2010-06-09","1.6","X-ray"
"3KZ8","Protein/DNA","Diversity in DNA recognition by p53 revealed by crystal structures with Hoogsteen base pairs (p53-DNA complex 3)","2010-03-31","1.9","X-ray"
"3L1P","Protein/DNA","POU protein:DNA complex","2010-12-15","2.8","X-ray"
"3L2C","Protein/DNA","Crystal Structure of the DNA Binding Domain of FOXO4 Bound to DNA","2009-12-29","1.9","X-ray"
"3L2P","Protein/DNA","Human DNA Ligase III Recognizes DNA Ends by Dynamic Switching Between Two DNA Bound States","2010-07-14","3.0","X-ray"
"3L2Q","Protein/DNA","Crystal structure of the Prototype Foamy Virus (PFV) intasome in apo form","2010-02-09","3.3","X-ray"
"3L2R","Protein/DNA","Crystal structure of the Prototype Foamy Virus (PFV) intasome in complex with magnesium","2010-02-09","2.9","X-ray"
"3L2U","Protein/DNA","Crystal structure of the Prototype Foamy Virus (PFV) intasome in complex with magnesium and GS9137 (Elvitegravir)","2010-02-09","3.1","X-ray"
"3L2V","Protein/DNA","Crystal structure of the Prototype Foamy Virus (PFV) intasome in complex with manganese and MK0518 (Raltegravir)","2010-02-09","3.2","X-ray"
"3L2W","Protein/DNA","Crystal structure of the Prototype Foamy Virus (PFV) intasome in complex with manganese and GS9137 (Elvitegravir)","2010-02-09","3.2","X-ray"
"3L4J","Protein/DNA","Topoisomerase II-DNA cleavage complex, apo","2010-05-26","2.5","X-ray"
"3L4K","Protein/DNA","Topoisomerase II-DNA cleavage complex, metal-bound","2010-05-26","3.0","X-ray"
"3L8B","Protein/DNA","Crystal structure of a replicative DNA polymerase bound to the oxidized guanine lesion guanidinohydantoin","2010-03-09","2.1","X-ray"
"3LAJ","Protein/DNA","The Structure of the Intermediate Complex of the Arginine Repressor from Mycobacterium tuberculosis Bound to its DNA Operator and L-arginine.","2010-05-05","2.3","X-ray"
"3LAP","Protein/DNA","The Structure of the Intermediate Complex of the Arginine Repressor from Mycobacterium tuberculosis Bound to its DNA Operator and L-canavanine.","2010-05-05","2.1","X-ray"
"3LDS","Protein/DNA","Crystal structure of RB69 gp43 with DNA and dATP opposite 8-oxoG","2010-06-02","3.0","X-ray"
"3LDY","Protein/DNA","An extraordinary mechanism of DNA perturbation exhibited by the rare-cutting HNH restriction endonuclease PacI","2010-04-21","2.0","X-ray"
"3LEL","Protein/DNA","Structural Insight into the Sequence-Dependence of Nucleosome Positioning","2010-05-19","3.0","X-ray"
"3LJA","Protein/DNA","Using Soft X-Rays for a Detailed Picture of Divalent Metal Binding in the Nucleosome","2010-04-14","2.8","X-ray"
"3LK9","Protein/DNA","DNA polymerase beta with a gapped DNA substrate and dTMP(CF2)P(CF2)P","2011-01-12","2.5","X-ray"
"3LNQ","Protein/DNA","Structure of Aristaless homeodomain in complex with DNA","2010-04-28","2.3","X-ray"
"3LSP","Protein/DNA","Crystal Structure of DesT bound to desCB promoter and oleoyl-CoA","2010-08-04","2.7","X-ray"
"3LSR","Protein/DNA","Crystal structure of DesT in complex with duplex DNA","2010-08-04","2.5","X-ray"
"3LTN","Protein/DNA","Inhibitor-stabilized topoisomerase IV-DNA cleavage complex (S. pneumoniae)","2010-05-05","3.1","X-ray"
"3LWH","Protein/DNA","Crystal structure of Cren7-dsDNA complex","2010-05-26","1.9","X-ray"
"3LWI","Protein/DNA","Crystal structure of Cren7-dsDNA complex","2010-05-26","2.3","X-ray"
"3LWL","Protein/DNA","Structure of Klenow fragment of Taq polymerase in complex with an abasic site","2010-05-05","2.3","X-ray"
"3LWM","Protein/DNA","Structure of the large fragment of thermus aquaticus DNA polymerase I in complex with a blunt-ended DNA and ddATP","2010-05-05","2.2","X-ray"
"3LZ0","Protein/DNA","Crystal Structure of Nucleosome Core Particle Composed of the Widom 601 DNA Sequence (orientation 1)","2010-09-15","2.5","X-ray"
"3LZ1","Protein/DNA","Crystal Structure of Nucleosome Core Particle Composed of the Widom 601 DNA Sequence (orientation 2)","2010-09-15","2.5","X-ray"
"3LZI","Protein/DNA","RB69 DNA Polymerase (Y567A) ternary complex with dATP Opposite 7,8-dihydro-8-oxoguanine","2010-05-12","2.3","X-ray"
"3LZJ","Protein/DNA","RB69 DNA Polymerase (Y567A) ternary complex with dCTP Opposite 7,8-Dihydro-8-oxoguanine","2010-05-19","2.0","X-ray"
"3M4A","Protein/DNA","Crystal structure of a bacterial topoisomerase IB in complex with DNA reveals a secondary DNA binding site","2010-07-14","1.6","X-ray"
"3M7K","Protein/DNA","Crystal structure of PacI-DNA Enzyme product complex","2010-04-21","1.9","X-ray"
"3M8R","Protein/DNA","Crystal structure of the large fragment of DNA polymerase I from Thermus aquaticus in a closed ternary complex with trapped 4'-ethylated dTTP","2010-07-07","2.0","X-ray"
"3M8S","Protein/DNA","Crystal structure of the large fragment of DNA polymerase I from Thermus aquaticus in a closed ternary complex with trapped 4'-methylated dTTP","2010-07-07","2.2","X-ray"
"3M9E","Protein/DNA","Thyroid hormone beta DNA binding domain homodimer with inverted palindrome TRE","2010-08-18","2.4","X-ray"
"3M9M","Protein/DNA","Crystal Structure of Dpo4 in complex with DNA containing the major cisplatin lesion","2010-06-16","2.9","X-ray"
"3M9N","Protein/DNA","Crystal Structure of Dpo4 in complex with DNA containing the major cisplatin lesion","2010-06-16","1.9","X-ray"
"3M9O","Protein/DNA","Crystal Structure of Dpo4 in complex with DNA containing the major cisplatin lesion","2010-06-16","2.0","X-ray"
"3MAQ","Protein/DNA","Crystal structure of E.coli Pol II-normal DNA-dGTP ternary complex","2010-04-07","2.4","X-ray"
"3MBY","Protein/DNA","Ternary complex of DNA Polymerase BETA with template base A and 8oxodGTP in the active site with a dideoxy terminated primer","2010-06-09","2.0","X-ray"
"3MDA","Protein/DNA","DNA polymerase lambda in complex with araC","2010-04-28","2.0","X-ray"
"3MDC","Protein/DNA","DNA polymerase lambda in complex with dFdCTP","2010-04-28","2.0","X-ray"
"3MFH","Protein/DNA","DNA Polymerase Eta in Complex With Undamaged DNA","2010-06-23","2.0","X-ray"
"3MFI","Protein/DNA","DNA Polymerase Eta in Complex With a cis-syn Thymidine Dimer","2010-06-23","1.8","X-ray"
"3MFK","Protein/DNA","Ets1 complex with stromelysin-1 promoter DNA","2010-08-18","3.0","X-ray"
"3MGH","Protein/DNA","Binary complex of a DNA polymerase lambda loop mutant","2010-05-19","2.4","X-ray"
"3MGI","Protein/DNA","Ternary complex of a DNA polymerase lambda loop mutant","2010-05-19","2.6","X-ray"
"3MGP","Protein/DNA","Binding of Cobalt ions to the Nucleosome Core Particle","2010-06-16","2.4","X-ray"
"3MGQ","Protein/DNA","Binding of Nickel ions to the Nucleosome Core Particle","2010-06-16","2.6","X-ray"
"3MGR","Protein/DNA","Binding of Rubidium ions to the Nucleosome Core Particle","2010-06-16","2.3","X-ray"
"3MGS","Protein/DNA","Binding of Cesium ions to the Nucleosome Core particle","2010-06-16","3.1","X-ray"
"3MGV","Protein/DNA","Cre recombinase-DNA transition state","2010-05-26","2.3","X-ray"
"3MHT","Protein/DNA","TERNARY STRUCTURE OF HHAI METHYLTRANSFERASE WITH UNMODIFIED DNA AND ADOHCY","1997-01-27","2.7","X-ray"
"3MIP","Protein/DNA","I-MsoI re-designed for altered DNA cleavage specificity (-8GCG)","2010-05-19","2.4","X-ray"
"3MIS","Protein/DNA","I-MsoI re-designed for altered DNA cleavage specificity (-8G)","2010-05-19","2.3","X-ray"
"3MKW","Protein/DNA","Structure of sopB(155-272)-18mer complex, I23 form","2010-05-05","3.0","X-ray"
"3MKY","Protein/DNA","Structure of SopB(155-323)-18mer DNA complex, I23 form","2010-05-05","2.9","X-ray"
"3MKZ","Protein/DNA","Structure of SopB(155-272)-18mer complex, P21 form","2010-05-05","3.0","X-ray"
"3MLN","Protein/DNA","DNA binding domain of Early B-cell Factor 1 (Ebf1) bound to DNA (crystal form II)","2010-12-01","2.4","X-ray"
"3MLO","Protein/DNA","DNA binding domain of Early B-cell Factor 1 (Ebf1) bound to DNA (Crystal form I)","2010-12-01","3.0","X-ray"
"3MLP","Protein/DNA","Early B-cell Factor 1 (Ebf1) bound to DNA","2010-12-01","2.8","X-ray"
"3MNN","Protein/DNA","A Ruthenium Antitumour Agent Forms Specific Histone Protein Adducts in the Nucleosome Core","2011-04-06","2.5","X-ray"
"3MQ6","Protein/DNA","Domain swapped SgrAI with DNA and calcium bound","2010-11-10","2.0","X-ray"
"3MQY","Protein/DNA","SgrAI with cleaved DNA and Magnesium bound","2010-11-24","2.0","X-ray"
"3MR2","Protein/DNA","Human DNA polymerase eta in complex with normal DNA and incoming nucleotide (Nrm)","2010-06-30","1.8","X-ray"
"3MR3","Protein/DNA","Human DNA polymerase eta - DNA ternary complex with the 3'T of a CPD in the active site (TT1)","2010-06-30","1.8","X-ray"
"3MR5","Protein/DNA","Human DNA polymerase eta - DNA ternary complex with a CPD 1bp upstream of the active site (TT3)","2010-06-30","1.8","X-ray"
"3MR6","Protein/DNA","Human DNA polymerase eta - DNA ternary complex with a CPD 2bp upstream of the active site (TT4)","2010-06-30","1.9","X-ray"
"3MU6","Protein/DNA","Inhibiting the Binding of Class IIa Histone Deacetylases to Myocyte Enhancer Factor-2 by Small Molecules","2011-11-02","2.4","X-ray"
"3MVA","Protein/DNA","Crystal structure of human MTERF1 bound to the termination sequence","2010-06-30","2.2","X-ray"
"3MVB","Protein/DNA","Crystal structure of a triple RFY mutant of human MTERF1 bound to the termination sequence","2010-06-30","2.8","X-ray"
"3MVD","Protein/DNA","Crystal structure of the chromatin factor RCC1 in complex with the nucleosome core particle","2010-08-25","2.9","X-ray"
"3MX4","Protein/DNA","DNA binding and cleavage by the GIY-YIG endonuclease R.Eco29KI inactive variant E142Q","2010-09-08","2.5","X-ray"
"3MX9","Protein/DNA","Molecular basis of engineered meganuclease targeting of the endogenous human RAG1 locus","2010-10-06","2.6","X-ray"
"3MXA","Protein/DNA","Molecular basis of engineered meganuclease targeting of the endogenous human RAG1 locus","2010-10-06","2.3","X-ray"
"3MXB","Protein/DNA","Molecular basis of engineered meganuclease targeting of the endogenous human RAG1 locus","2010-10-06","2.3","X-ray"
"3MXI","Protein/DNA","TREX1 3' Exonuclease D18N Familial Chilblain Lupus Mutant","2011-05-18","2.5","X-ray"
"3MXM","Protein/DNA","TREX1 3' Exonuclease V201D Aicardi-Goutieres Syndrome Mutant","2011-05-18","1.8","X-ray"
"3MZH","Protein/DNA","Crystal structure of cAMP receptor protein from mycobacterium tuberculosis in complex with cAMP and its DNA binding element","2011-06-08","2.9","X-ray"
"3N1I","Protein/DNA","Crystal Structure of a StWhy2-ERE32 complex","2010-08-11","2.2","X-ray"
"3N1J","Protein/DNA","Crystal structure of a StWhy2-dT32 complex","2010-08-11","2.6","X-ray"
"3N1K","Protein/DNA","Crystal Structure of a StWhy2-cERE32 complex","2010-08-11","2.7","X-ray"
"3N1L","Protein/DNA","Crystal Structure of a StWhy2-rcERE32 complex","2010-08-11","2.4","X-ray"
"3N4M","Protein/DNA","E. coli RNA polymerase alpha subunit C-terminal domain in complex with CAP and DNA","2011-05-25","3.0","X-ray"
"3N6S","Protein/DNA","Crystal structure of human mitochondrial mTERF in complex with a 15-mer DNA encompassing the tRNALeu(UUR) binding sequence","2010-06-16","3.1","X-ray"
"3N78","Protein/DNA","SgrAI bound to Secondary Site DNA and Mg(II)","2010-11-24","3.0","X-ray"
"3N7B","Protein/DNA","SgrAI bound to secondary site DNA and Ca(II)","2010-11-24","2.6","X-ray"
"3N7Q","Protein/DNA","Crystal structure of human mitochondrial mTERF fragment (aa 99-399) in complex with a 12-mer DNA encompassing the tRNALeu(UUR) binding sequence","2010-06-16","2.4","X-ray"
"3N97","Protein/DNA","RNA polymerase alpha C-terminal domain (E. coli) and sigma region 4 (T. aq. mutant) bound to (UP,-35 element) DNA","2011-06-08","3.3","X-ray"
"3NAE","Protein/DNA","RB69 DNA Polymerase (Y567A) Ternary Complex with dATP Opposite Guanidinohydantoin","2010-09-15","2.0","X-ray"
"3NBN","Protein/DNA","Crystal structure of a dimer of Notch Transcription Complex trimers on HES1 DNA","2010-11-03","3.5","X-ray"
"3NCI","Protein/DNA","RB69 DNA Polymerase Ternary Complex with dCTP Opposite dG at 1.8 angstrom resolution","2011-02-02","1.8","X-ray"
"3NDH","Protein/DNA","Restriction endonuclease in complex with substrate DNA","2010-07-28","1.3","X-ray"
"3NDK","Protein/DNA","RB69 DNA Polymerase (Y567A) Ternary Complex with dCTP Opposite dG","2011-01-26","2.0","X-ray"
"3NE6","Protein/DNA","RB69 DNA Polymerase (S565G/Y567A) Ternary Complex with dCTP Opposite dG","2011-01-26","2.0","X-ray"
"3NGD","Protein/DNA","Structural Basis for Proficient Incorporation of dTTP Opposite O6-methylguanine by Human DNA Polymerase Iota","2010-10-20","2.8","X-ray"
"3NGI","Protein/DNA","RB69 DNA Polymerase (Y567A) Ternary Complex with dTTP Opposite dG","2011-01-26","1.9","X-ray"
"3NGO","Protein/DNA","Crystal structure of the human CNOT6L nuclease domain in complex with poly(A) DNA","2010-07-28","2.2","X-ray"
"3NGZ","Protein/DNA","Crystal structure of RNase T in complex with a non-preferred ssDNA (GC) with one Mg in the active site","2011-02-16","2.1","X-ray"
"3NH0","Protein/DNA","Crystal structure of RNase T in complex with a non-preferred ssDNA (AAC)","2011-02-16","2.3","X-ray"
"3NH1","Protein/DNA","Crystal structure of RNase T in complex with a preferred ssDNA (TAGG) with two Mg in the active site","2011-02-16","2.1","X-ray"
"3NH2","Protein/DNA","Crystal structure of RNase T in complex with a stem DNA with a 3' overhang","2011-02-16","2.3","X-ray"
"3NHG","Protein/DNA","RB69 DNA Polymerase (S565G/Y567A) Ternary Complex with dTTP Opposite dG","2011-01-26","2.5","X-ray"
"3NIC","Protein/DNA","DNA binding and cleavage by the GIY-YIG endonuclease R.Eco29kI inactive variant Y49F","2010-09-08","2.8","X-ray"
"3NM9","Protein/DNA","HMGD(M13A)-DNA complex","2010-09-22","2.9","X-ray"
"3O1M","Protein/DNA","Iron-Catalyzed Oxidation Intermediates Captured in A DNA Repair Dioxygenase","2010-11-17","1.8","X-ray"
"3O1O","Protein/DNA","Iron-Catalyzed Oxidation Intermediates Captured in A DNA Repair Dioxygenase","2010-11-17","1.9","X-ray"
"3O1P","Protein/DNA","Iron-Catalyzed Oxidation Intermediates Captured in A DNA Repair Dioxygenase","2010-11-17","1.5","X-ray"
"3O1R","Protein/DNA","Iron-Catalyzed Oxidation Intermediates Captured in A DNA Repair Dioxygenase","2010-11-17","1.8","X-ray"
"3O1S","Protein/DNA","Iron-Catalyzed Oxidation Intermediates Captured in A DNA Repair Dioxygenase","2010-11-17","1.6","X-ray"
"3O1T","Protein/DNA","Iron-Catalyzed Oxidation Intermediates Captured in A DNA Repair Dioxygenase","2010-11-17","1.5","X-ray"
"3O1U","Protein/DNA","Iron-Catalyzed Oxidation Intermediates Captured in A DNA Repair Dioxygenase","2010-11-17","1.5","X-ray"
"3O1V","Protein/DNA","Iron-Catalyzed Oxidation Intermediates Captured in A DNA Repair Dioxygenase","2010-11-17","1.9","X-ray"
"3O62","Protein/DNA","Nucleosome core particle modified with a cisplatin 1,3-cis-{Pt(NH3)2}2+-d(GpTpG) intrastrand cross-link","2011-01-05","3.2","X-ray"
"3O9X","Protein/DNA","Structure of the E. coli antitoxin MqsA (YgiT/b3021) in complex with its gene promoter","2010-11-10","2.1","X-ray"
"3OA6","Protein/DNA","Human MSL3 Chromodomain bound to DNA and H4K20me1 peptide","2010-08-18","2.4","X-ray"
"3OD8","Protein/DNA","Human PARP-1 zinc finger 1 (Zn1) bound to DNA","2011-01-12","2.4","X-ray"
"3ODA","Protein/DNA","Human PARP-1 zinc finger 1 (Zn1) bound to DNA","2011-01-12","2.6","X-ray"
"3ODC","Protein/DNA","Human PARP-1 zinc finger 2 (Zn2) bound to DNA","2011-01-12","2.8","X-ray"
"3ODE","Protein/DNA","Human PARP-1 zinc finger 2 (Zn2) bound to DNA","2011-01-12","3.0","X-ray"
"3ODH","Protein/DNA","Structure of OkrAI/DNA complex","2010-10-06","2.3","X-ray"
"3OGD","Protein/DNA","AlkA Undamaged DNA Complex: Interrogation of a G*:C base pair","2010-09-15","2.8","X-ray"
"3OGU","Protein/DNA","DNA Polymerase beta mutant 5P20 complexed with 6bp of DNA","2010-11-24","1.8","X-ray"
"3OH6","Protein/DNA","AlkA Undamaged DNA Complex: Interrogation of a C:G base pair","2010-09-15","2.9","X-ray"
"3OH9","Protein/DNA","AlkA Undamaged DNA Complex: Interrogation of a T:A base pair","2010-09-15","2.8","X-ray"
"3OHA","Protein/DNA","Yeast DNA polymerase eta inserting dCTP opposite an 8oxoG lesion","2010-12-22","2.0","X-ray"
"3OHB","Protein/DNA","Yeast DNA polymerase eta extending from an 8-oxoG lesion","2010-12-22","2.0","X-ray"
"3OJS","Protein/DNA","Snapshots of the large fragment of DNA polymerase I from Thermus Aquaticus processing C5 modified thymidines","2010-12-15","1.9","X-ray"
"3OJU","Protein/DNA","Snapshot of the large fragment of DNA polymerase I from Thermus Aquaticus processing c5 modified thymidies","2010-12-15","2.0","X-ray"
"3ON0","Protein/DNA","Crystal structure of the pED208 TraM-sbmA complex","2011-05-25","2.9","X-ray"
"3OOL","Protein/DNA","I-SceI complexed with C/G+4 DNA substrate","2010-11-17","2.3","X-ray"
"3OOR","Protein/DNA","I-SceI mutant (K86R/G100T)complexed with C/G+4 DNA substrate","2010-11-17","2.5","X-ray"
"3OQG","Protein/DNA","Restriction endonuclease HPY188I in complex with substrate DNA","2010-10-20","1.8","X-ray"
"3OQM","Protein/DNA","structure of ccpa-hpr-ser46p-ackA2 complex","2010-12-08","3.0","X-ray"
"3OQN","Protein/DNA","Structure of ccpa-hpr-ser46-p-gntr-down cre","2010-12-08","3.3","X-ray"
"3OQO","Protein/DNA","Ccpa-hpr-ser46p-syn cre","2011-10-26","3.0","X-ray"
"3OR3","Protein/DNA","Restriction endonuclease HPY188I in complex with product DNA","2010-10-20","1.9","X-ray"
"3ORC","Protein/DNA","CRYSTAL STRUCTURE OF AN ENGINEERED CRO MONOMER BOUND NONSPECIFICALLY TO DNA","1998-12-02","3.0","X-ray"
"3OS0","Protein/DNA","PFV strand transfer complex (STC) at 2.81 A resolution","2010-11-17","2.8","X-ray"
"3OS1","Protein/DNA","PFV target capture complex (TCC) at 2.97 A resolution","2010-11-17","3.0","X-ray"
"3OS2","Protein/DNA","PFV target capture complex (TCC) at 3.32 A resolution","2010-11-17","3.3","X-ray"
"3OSF","Protein/DNA","The structure of protozoan parasite Trichomonas vaginalis Myb2 in complex with MRE-2f-13 DNA","2011-08-03","2.0","X-ray"
"3OSG","Protein/DNA","The structure of protozoan parasite Trichomonas vaginalis Myb2 in complex with MRE-1-12 DNA","2011-08-03","2.0","X-ray"
"3OSN","Protein/DNA","Structural Basis for Proficient Incorporation of dTTP Opposite O6-Methylguanine by Human DNA Polymerase Iota","2010-10-20","1.9","X-ray"
"3OSP","Protein/DNA","Structure of rev1","2011-04-13","2.5","X-ray"
"3OY9","Protein/DNA","Crystal structure of the Prototype Foamy Virus (PFV) intasome in complex with manganese at 2.55 resolution","2010-10-20","2.5","X-ray"
"3OYA","Protein/DNA","Crystal structure of the Prototype Foamy Virus (PFV) intasome in complex with magnesium and raltegravir at 2.65 resolution","2010-10-20","2.6","X-ray"
"3OYB","Protein/DNA","Crystal structure of the Prototype Foamy Virus (PFV) intasome in complex with magnesium and the INSTI MK2048","2010-11-17","2.5","X-ray"
"3OYC","Protein/DNA","Crystal structure of the Prototype Foamy Virus (PFV) intasome in complex with magnesium and the INSTI PICA","2010-11-17","2.7","X-ray"
"3OYD","Protein/DNA","Crystal structure of the Prototype Foamy Virus (PFV) intasome in complex with magnesium and the INSTI GS9160","2010-11-17","2.5","X-ray"
"3OYE","Protein/DNA","Crystal structure of the Prototype Foamy Virus (PFV) intasome in complex with magnesium and the INSTI Compound2","2010-11-17","2.7","X-ray"
"3OYF","Protein/DNA","Crystal structure of the Prototype Foamy Virus (PFV) intasome in complex with magnesium and the INSTI L-870,810","2010-11-17","2.5","X-ray"
"3OYG","Protein/DNA","Crystal structure of the Prototype Foamy Virus (PFV) intasome in complex with magnesium and the INSTI Compound1 (CompoundG)","2010-11-17","2.6","X-ray"
"3OYH","Protein/DNA","Crystal structure of the Prototype Foamy Virus (PFV) intasome in complex with magnesium and the INSTI MK0536","2010-11-17","2.7","X-ray"
"3OYI","Protein/DNA","Crystal structure of the PFV S217Q mutant intasome in complex with manganese","2010-11-17","2.7","X-ray"
"3OYJ","Protein/DNA","Crystal structure of the PFV S217Q mutant intasome in complex with magnesium and the INSTI MK2048","2010-11-17","2.7","X-ray"
"3OYK","Protein/DNA","Crystal structure of the PFV S217H mutant intasome bound to manganese","2010-11-17","2.7","X-ray"
"3OYL","Protein/DNA","Crystal structure of the PFV S217H mutant intasome bound to magnesium and the INSTI MK2048","2010-11-17","2.5","X-ray"
"3OYM","Protein/DNA","Crystal structure of the PFV N224H mutant intasome bound to manganese","2010-11-17","2.0","X-ray"
"3OYN","Protein/DNA","Crystal structure of the PFV N224H mutant intasome bound to magnesium and the INSTI MK2048","2010-11-17","2.7","X-ray"
"3P57","Protein/DNA","Crystal structure of the p300 TAZ2 domain bound to MEF2 on DNA","2011-08-10","2.2","X-ray"
"3PIH","Protein/DNA","T. maritima UvrA in complex with fluorescein-modified DNA","2011-01-19","2.9","X-ray"
"3PJR","Protein/DNA","HELICASE SUBSTRATE COMPLEX","1999-04-08","3.3","X-ray"
"3PKY","Protein/DNA","Polymerase Domain from Mycobacterium tuberculosis Ligase D in complex with DNA, UTP and Manganese.","2011-02-16","3.1","X-ray"
"3PML","Protein/DNA","crystal structure of a polymerase lambda variant with a dGTP analog opposite a templating T","2011-01-26","2.6","X-ray"
"3PMN","Protein/DNA","ternary crystal structure of polymerase lambda variant with a GT mispair at the primer terminus with Mn2+ in the active site","2011-02-02","2.2","X-ray"
"3PNC","Protein/DNA","Ternary crystal structure of a polymerase lambda variant with a GT mispair at the primer terminus and sodium at catalytic metal site","2011-02-02","2.0","X-ray"
"3PO4","Protein/DNA","Structure of a mutant of the large fragment of DNA polymerase I from Thermus aquaticus in complex with a blunt-ended DNA and ddATP","2011-06-15","1.8","X-ray"
"3PO5","Protein/DNA","Structure of a mutant of the large fragment of DNA polymerase I from Thermus Auqaticus in complex with an abasic site and ddATP","2011-06-15","2.4","X-ray"
"3POV","Protein/DNA","Crystal structure of a SOX-DNA complex","2011-09-21","2.5","X-ray"
"3PR4","Protein/DNA","Dpo4 Y12A mutant incorporating dADP opposite template dT","2011-02-23","2.6","X-ray"
"3PR5","Protein/DNA","Dpo4 Y12A mutant incorporating ADP opposite template dT","2011-02-23","2.4","X-ray"
"3PT6","Protein/DNA","Crystal structure of mouse DNMT1(650-1602) in complex with DNA","2010-12-29","3.0","X-ray"
"3PTA","Protein/DNA","Crystal structure of human DNMT1(646-1600) in complex with DNA","2010-12-29","3.6","X-ray"
"3PV8","Protein/DNA","Crystal Structure of Bacillus DNA Polymerase I Large Fragment Bound to DNA and ddTTP-dA in Closed Conformation","2011-10-19","1.5","X-ray"
"3PVI","Protein/DNA","D34G MUTANT OF PVUII ENDONUCLEASE COMPLEXED WITH COGNATE DNA SHOWS THAT ASP34 IS DIRECTLY INVOLVED IN DNA RECOGNITION AND INDIRECTLY INVOLVED IN CATALYSIS","1998-10-14","1.6","X-ray"
