"ID","Polymer Composition","Entry Title","Release Date","Resolution (Å)","Method"
"6XH7","Protein/DNA","CueR-TAC without RNA","2021-04-14","3.9","EM"
"6XJD","Protein/DNA","Two mouse cGAS catalytic domain binding to human assembled nucleosome","2020-09-16","6.8","EM"
"6XL5","Protein/DNA","Cryo-EM structure of EcmrR-RNAP-promoter open complex (EcmrR-RPo)","2021-04-07","2.5","EM"
"6XL6","Protein/DNA","Cryo-EM structure of EcmrR-DNA complex in EcmrR-RPo","2021-04-07","3.0","EM"
"6XLA","Protein/DNA","Cryo-EM structure of EcmrR-DNA complex in EcmrR-RPitc-3nt","2021-04-07","3.1","EM"
"6XLK","Protein/DNA","Cryo-EM structure of EcmrR-DNA complex in EcmrR-RPitc-4nt","2021-04-07","3.3","EM"
"6XNX","Protein/DNA","Structure of RAG1 (R848M/E649V)-RAG2-DNA Strand Transfer Complex (Dynamic-Form)","2020-08-26","2.7","EM"
"6XNY","Protein/DNA","Structure of RAG1 (R848M/E649V)-RAG2-DNA Strand Transfer Complex (Paired-Form)","2020-08-26","2.9","EM"
"6XNZ","Protein/DNA","Structure of RAG1 (R848M/E649V)-RAG2-DNA Target Capture Complex","2020-08-26","3.8","EM"
"6XTX","Protein/DNA","CryoEM structure of human CMG bound to ATPgammaS and DNA","2020-05-27","3.3","EM"
"6XU0","Protein/DNA","Archaeoglobus fulgidus Argonaute protein with DNA oligoduplex 5'-pATCGTGGCCACGAT","2021-01-27","1.9","X-ray"
"6XUP","Protein/DNA","Archaeoglobus fulgidus Argonaute protein with DNA oligoduplex 5'-pATCGTGGCCACGAT","2021-02-03","1.9","X-ray"
"6XWG","Protein/DNA","Crystal Structure of the Human RXR/RAR DNA-Binding Domain Heterodimer Bound to the Human RARb2 DR5 Response Element","2020-09-09","2.4","X-ray"
"6XWH","Protein/DNA","Crystal Structure of the Human RXR DNA-Binding Domain Homodimer Bound to the Human Hoxb13 DR0 Response Element","2020-09-09","2.1","X-ray"
"6Y35","Protein/DNA","CCAAT-binding complex from Aspergillus fumigatus with cycA DNA","2020-05-27","2.6","X-ray"
"6Y36","Protein/DNA","CCAAT-binding complex from Aspergillus fumigatus with cccA DNA","2020-05-27","2.3","X-ray"
"6Y37","Protein/DNA","CCAAT-binding complex from Aspergillus nidulans with cccA DNA","2020-05-27","2.2","X-ray"
"6Y39","Protein/DNA","HapE-P88L mutant CCAAT-binding complex from Aspergillus nidulans with cycA DNA","2020-05-27","2.3","X-ray"
"6Y42","Protein/DNA","Crystal Structure of RsrR complexed to a 39 basepair DNA fragment of the rsrR promoter","2020-03-04","4.3","X-ray"
"6Y5D","Protein/DNA","Structure of human cGAS (K394E) bound to the nucleosome","2020-09-23","4.1","EM"
"6Y5E","Protein/DNA","Structure of human cGAS (K394E) bound to the nucleosome (focused refinement of cGAS-NCP subcomplex)","2020-09-23","3.1","EM"
"6Y93","Protein/DNA","Crystal structure of the DNA-binding domain of the Nucleoid Occlusion Factor (Noc) complexed to the Noc-binding site (NBS)","2020-08-05","2.2","X-ray"
"6YCQ","Protein/DNA","Crystal structure of the DNA binding domain of Arabidopsis thaliana Auxin Response Factor 1 (AtARF1) in complex with High Affinity DNA","2020-09-09","1.6","X-ray"
"6YCS","Protein/DNA","Human Transcription Cofactor PC4 DNA-binding domain in complex with full phosphorothioate 5-10-5 2'-O-methyl DNA gapmer antisense oligonucleotide.","2020-04-29","3.0","X-ray"
"6YJB","Protein/DNA","VcaM4I restriction endonuclease 5hmC-ssDNA complex","2020-12-23","1.6","X-ray"
"6YKF","Protein/DNA","VcaM4I restriction endonuclease in the presence of 5mC-modified ssDNA","2020-12-23","1.5","X-ray"
"6YL2","Protein/DNA","Structural and DNA binding studies of the transcriptional repressor Rv2506 (BkaR) from Mycobacterium tuberculosis supports a role in L-Leucine catabolism","2021-04-14","3.1","X-ray"
"6YMG","Protein/DNA","VcaM4I restriction endonuclease in complex with 5mC-modified dsDNA","2020-12-23","3.1","X-ray"
"6YMV","Protein/DNA","Cryo-EM structure of yeast mitochondrial RNA polymerase partially-melted transcription initiation complex (PmIC)","2020-12-02","3.1","EM"
"6YOV","Protein/DNA","OCT4-SOX2-bound nucleosome - SHL+6","2020-05-06","3.4","EM"
"6YUF","Protein/DNA","Cohesin complex with loader gripping DNA","2020-08-19","3.9","EM"
"6YWW","Protein/DNA","MeCP2 is a microsatellite binding protein that protects CA repeats from nucleosome invasion","2021-06-16","2.1","X-ray"
"6Z0S","Protein/DNA","Allostery through DNA drives phenotype switching","2021-04-07","5.7","EM"
"6Z1A","Protein/DNA","Ternary complex of Staphylococcus aureus DNA gyrase with AMK12 and DNA","2020-11-11","2.3","X-ray"
"6Z6P","Protein/DNA","HDAC-PC-Nuc","2021-02-17","4.4","EM"
"6Z8V","Protein/DNA","X-ray structure of the complex between human alpha thrombin and a thrombin binding aptamer variant (TBA-3L), which contains 1-beta-D-lactopyranosyl residue in the side chain of Thy3 at N3.","2021-01-27","1.6","X-ray"
"6Z8W","Protein/DNA","X-ray structure of the complex between human alpha thrombin and a thrombin binding aptamer variant (TBA-3G), which contains 1-beta-D-glucopyranosyl residue in the side chain of Thy3 at N3.","2021-01-27","1.7","X-ray"
"6Z8X","Protein/DNA","X-ray structure of the complex between human alpha thrombin and a thrombin binding aptamer variant (TBA-3Leu), which contains leucyl amide in the side chain of Thy3 at N3.","2021-01-27","2.5","X-ray"
"6ZA3","Protein/DNA","Structure of the transcriptional repressor Atu1419 (VanR) from agrobacterium fabrum in complex a palindromic DNA (C2221 space group)","2020-12-02","2.0","X-ray"
"6ZAB","Protein/DNA","Structure of the transcriptional repressor Atu1419 (VanR) from agrobacterium fabrum in complex a palindromic DNA (P6422 space group)","2020-12-02","2.8","X-ray"
"6ZH8","Protein/DNA","Cryo-EM structure of DNA-PKcs:DNA","2020-10-21","4.1","EM"
"6ZHA","Protein/DNA","Cryo-EM structure of DNA-PK monomer","2020-10-21","3.9","EM"
"6ZHE","Protein/DNA","Cryo-EM structure of DNA-PK dimer","2020-10-21","7.2","EM"
"6ZHX","Protein/DNA","Cryo-EM structure of the regulatory linker of ALC1 bound to the nucleosome's acidic patch: nucleosome class.","2020-12-23","2.5","EM"
"6ZHY","Protein/DNA","Cryo-EM structure of the regulatory linker of ALC1 bound to the nucleosome's acidic patch: hexasome class.","2020-12-23","3.0","EM"
"6ZIX","Protein/DNA","Structure of RcsB from Salmonella enterica serovar Typhimurium bound to promoter P1flhDC in the presence of phosphomimetic BeF3-","2021-02-17","3.4","X-ray"
"6ZJ2","Protein/DNA","Structure of RcsB from Salmonella enterica serovar Typhimurium bound to promoter rprA in the presence of phosphomimetic BeF3-","2021-02-17","3.4","X-ray"
"6ZMN","Protein/DNA","Crystal structure of the Smad3-Smad5 MH1 domain chimera bound to the GGCGC site","2020-08-26","2.3","X-ray"
"6ZNC","Protein/DNA","Structural basis of reactivation of oncogenic p53 mutants by a small molecule: methylene quinuclidinone (MQ). Human wild-type p53DBD bound to DNA and MQ: wt-DNA-MQ (I)","2021-12-08","1.6","X-ray"
"6ZNP","Protein/DNA","Crystal Structure of DUF1998 helicase MrfA bound to DNA","2020-11-25","3.2","X-ray"
"6ZNQ","Protein/DNA","Crystal Structure of DUF1998 helicase MrfA bound to DNA and AMPPNP","2020-11-25","3.3","X-ray"
"6ZY5","Protein/DNA","Cryo-EM structure of the Human topoisomerase II alpha DNA-binding/cleavage domain in State 1","2021-05-26","3.6","EM"
"6ZY6","Protein/DNA","Cryo-EM structure of the Human topoisomerase II alpha DNA-binding/cleavage domain in State 2","2021-05-26","4.1","EM"
"6ZY7","Protein/DNA","Cryo-EM structure of the entire Human topoisomerase II alpha in State 1","2021-05-26","4.6","EM"
"6ZY8","Protein/DNA","Cryo-EM structure of the entire Human topoisomerase II alpha in State 2","2021-05-26","7.4","EM"
"6ZZ6","Protein/DNA","Cryo-EM structure of S.cerevisiae cohesin-Scc2-DNA complex","2020-09-30","3.4","EM"
"7A08","Protein/DNA","CryoEM Structure of cGAS Nucleosome complex","2020-09-23","3.1","EM"
"7ABS","Protein/DNA","Structure of human DCLRE1C/Artemis in complex with DNA - re-evaluation of 6WO0","2021-08-04","2.0","X-ray"
"7AD8","Protein/DNA","Core TFIIH-XPA-DNA complex with modelled p62 subunit","2021-07-28","3.5","EM"
"7ADU","Protein/DNA","Crystal structure of the Prototype Foamy Virus (PFV) intasome in complex with magnesium and the INSTI XZ440 (compound 5j)","2021-03-24","2.6","X-ray"
"7ADV","Protein/DNA","Crystal structure of the Prototype Foamy Virus (PFV) intasome in complex with magnesium and the INSTI XZ447 (compound 6v)","2021-03-24","2.6","X-ray"
"7AEO","Protein/DNA","Human ARTD2 in complex with DNA oligonucleotides","2021-05-19","2.8","X-ray"
"7AHX","Protein/DNA","HIV-1 REVERSE TRANSCRIPTASE COMPLEX WITH DNA AND D-ASPARTATE TENOFOVIR WITH BOUND MANGANESE","2021-01-13","2.7","X-ray"
"7AI5","Protein/DNA","MutS in Scanning state","2021-03-31","4.4","EM"
"7AI6","Protein/DNA","MutS in mismatch bound state","2021-03-31","6.9","EM"
"7AI7","Protein/DNA","MutS in Intermediate state","2021-03-31","3.9","EM"
"7AIB","Protein/DNA","MutS-MutL in clamp state","2021-03-31","4.7","EM"
"7AIC","Protein/DNA","MutS-MutL in clamp state (kinked clamp domain)","2021-03-31","5.0","EM"
"7AID","Protein/DNA","HIV-1 REVERSE TRANSCRIPTASE COMPLEX WITH DNA AND D-ASPARTATE TENOFOVIR","2021-01-13","3.1","X-ray"
"7AIF","Protein/DNA","HIV-1 REVERSE TRANSCRIPTASE COMPLEX WITH DNA AND L-GLUTAMATE TENOFOVIR WITH BOUND MANGANESE","2021-01-13","2.8","X-ray"
"7AIG","Protein/DNA","HIV-1 REVERSE TRANSCRIPTASE COMPLEX WITH DNA AND L-GLUTAMATE TENOFOVIR","2021-01-13","3.0","X-ray"
"7AII","Protein/DNA","HIV-1 REVERSE TRANSCRIPTASE COMPLEX WITH DNA AND L-METHIONINE TENOFOVIR WITH BOUND MANGANESE","2021-01-13","2.6","X-ray"
"7AIJ","Protein/DNA","HIV-1 REVERSE TRANSCRIPTASE COMPLEX WITH DNA AND L-METHIONINE TENOFOVIR","2021-01-13","3.0","X-ray"
"7AMN","Protein/DNA","Structure of LuxR with DNA (repression)","2021-03-31","2.3","X-ray"
"7AMT","Protein/DNA","Structure of LuxR with DNA (activation)","2021-03-31","2.6","X-ray"
"7AMV","Protein/DNA","Atomic structure of the poxvirus transcription pre-initiation complex in the initially melted state","2021-10-06","2.8","EM"
"7APD","Protein/DNA","Bovine Papillomavirus E1 DNA helicase-replication fork complex","2021-11-17","3.9","EM"
"7AT8","Protein/DNA","Histone H3 recognition by nucleosome-bound PRC2 subunit EZH2.","2020-12-09","4.4","EM"
"7AUD","Protein/DNA","Structure of an engineered helicase domain construct for human Bloom syndrome protein (BLM)","2020-12-16","3.0","X-ray"
"7AW7","Protein/DNA","CCAAT-binding complex and HapX bound to Aspergillus nidulans cccA DNA","2022-04-13","3.4","X-ray"
"7AW9","Protein/DNA","CCAAT-binding complex and HapX bound to Aspergillus fumigatus cccA DNA","2022-04-13","3.5","X-ray"
"7AY1","Protein/DNA","Cryo-EM structure of USP1-UAF1 bound to mono-ubiquitinated FANCD2, and FANCI","2021-03-24","3.7","EM"
"7B0C","Protein/DNA","[4Fe-4S]-NsrR complexed to 23-bp HmpA1 operator fragment","2022-06-01","3.0","X-ray"
"7B0F","Protein/DNA","TgoT_6G12 Binary complex","2020-12-30","2.8","X-ray"
"7B0G","Protein/DNA","TgoT_6G12 binary with 2 hCTPs","2020-12-30","3.0","X-ray"
"7B0H","Protein/DNA","TgoT_6G12 Ternary complex","2021-01-13","3.1","X-ray"
"7B1Y","Protein/DNA","DtxR-like iron-dependent regulator IdeR complexed with cobalt and its consensus DNA-binding sequence","2021-03-03","2.1","X-ray"
"7B20","Protein/DNA","DtxR-like iron-dependent regulator IdeR complexed with iron and its consensus DNA-binding sequence","2021-03-03","2.2","X-ray"
"7B23","Protein/DNA","DtxR-like iron-dependent regulator IdeR complexed with cobalt and the SACE_2689 promoter DNA-binding sequence","2021-03-03","2.1","X-ray"
"7B24","Protein/DNA","DtxR-like iron-dependent regulator IdeR (P39G variant) complexed with cobalt and its consensus DNA-binding sequence","2021-03-03","2.0","X-ray"
"7B25","Protein/DNA","DtxR-like iron-dependent regulator IdeR (Q43A variant) complexed with cobalt and its consensus DNA-binding sequence","2021-03-03","2.3","X-ray"
"7B46","Protein/DNA","Structural basis of reactivation of oncogenic p53 mutants by a small molecule: methylene quinuclidinone (MQ). Human wild-type p53DBD bound to DNA and MQ: wt-DNA-MQ (P1)","2021-12-08","2.0","X-ray"
"7B49","Protein/DNA","Structural basis of reactivation of oncogenic p53 mutants by a small molecule: methylene quinuclidinone (MQ). Human p53DBD-R273H mutant bound to DNA and MQ: R273H-DNA-MQ","2021-12-08","1.4","X-ray"
"7B4A","Protein/DNA","Structural basis of reactivation of oncogenic p53 mutants by a small molecule: methylene quinuclidinone (MQ). Human p53DBD-R273H mutant bound to DNA: R273H-DNA","2021-12-08","1.9","X-ray"
"7B4D","Protein/DNA","Structural basis of reactivation of oncogenic p53 mutants by a small molecule: methylene quinuclidinone (MQ). Human p53DBD-R273C/S240R double mutant bound to DNA and MQ: R273C/S240R-DNA-MQ","2021-12-08","1.9","X-ray"
"7B4E","Protein/DNA","Structural basis of reactivation of oncogenic p53 mutants by a small molecule: methylene quinuclidinone (MQ). Human p53DBD-R282W mutant bound to DNA and MQ: R282W-DNA-MQ","2021-12-08","1.6","X-ray"
"7B4F","Protein/DNA","Structural basis of reactivation of oncogenic p53 mutants by a small molecule: methylene quinuclidinone (MQ). Human p53DBD-R282W mutant bound to DNA: R282W-MQ (I)","2021-12-08","1.8","X-ray"
"7B4G","Protein/DNA","Structural basis of reactivation of oncogenic p53 mutants by a small molecule: methylene quinuclidinone (MQ). Human p53DBD-R282W mutant bound to DNA: R282W-MQ (II)","2021-12-08","1.9","X-ray"
"7B4H","Protein/DNA","Structural basis of reactivation of oncogenic p53 mutants by a small molecule: methylene quinuclidinone (MQ). Human wild-type p53DBD bound to DNA and MQ: wt-DNA-MQ (III)","2021-12-08","1.4","X-ray"
"7B4N","Protein/DNA","Structural basis of reactivation of oncogenic p53 mutants by a small molecule: methylene quinuclidinone (MQ). Human wild-type p53DBD bound to DNA and MQ: wt-DNA-MQ (II)","2021-12-08","1.3","X-ray"
"7B5Y","Protein/DNA","S. agalactiae BusR in complex with its busAB-promotor DNA","2021-08-11","7.1","EM"
"7BCA","Protein/DNA","Crystal structure of the HTH DNA binding protein ArdK from R388 plasmid bound to a direct-repeat DNA element","2022-07-13","2.8","X-ray"
"7BCB","Protein/DNA","Crystal structure of the HTH DNA binding protein ArdK from R388 plasmid bound to IR3 DNA","2022-01-12","2.8","X-ray"
"7BEF","Protein/DNA","Structures of class II bacterial transcription complexes","2021-12-01","4.5","EM"
"7BEG","Protein/DNA","Structures of class I bacterial transcription complexes","2021-12-01","4.2","EM"
"7BHY","Protein/DNA","DNA-binding domain of DeoR in complex with the DNA operator","2021-11-10","2.3","X-ray"
"7BIL","Protein/DNA","Crystal structure of helicase Pif1 from Thermus oshimai in complex with oligo GGTTTGGTTTGGTT","2021-04-07","2.2","X-ray"
"7BJQ","Protein/DNA","Crystal structure of RecJCdc45 from Methanothermobacter thermoautotroficus in complex with ssDNA","2022-07-27","2.7","X-ray"
"7BTQ","Protein/DNA","EcoR124I-DNA in the Restriction-Alleviation State","2020-05-27","4.5","EM"
"7BWD","Protein/DNA","Structure of Dot1L-H2BK34ub Nucleosome Complex","2021-04-14","4.3","EM"
"7BXT","Protein/DNA","The cryo-EM structure of CENP-A nucleosome in complex with CENP-C peptide and CENP-N N-terminal domain","2021-02-10","4.2","EM"
"7BY0","Protein/DNA","The cryo-EM structure of CENP-A nucleosome in complex with the phosphorylated CENP-C","2021-02-10","4.5","EM"
"7BZG","Protein/DNA","Structure of Bacillus subtilis HxlR, wild type in complex with formaldehyde and DNA","2021-02-03","2.9","X-ray"
"7C0G","Protein/DNA","Aca1 in complex with 14bp palindromic DNA target","2021-05-05","2.4","X-ray"
"7C0I","Protein/DNA","Crystal structure of chimeric mutant of E3L in complex with Z-DNA","2020-12-16","2.4","X-ray"
"7C0J","Protein/DNA","Crystal structure of chimeric mutant of GH5 in complex with Z-DNA","2020-12-16","2.8","X-ray"
"7C0M","Protein/DNA","Human cGAS-nucleosome complex","2020-09-16","3.9","EM"
"7C17","Protein/DNA","The cryo-EM structure of E. coli CueR transcription activation complex with fully duplex promoter DNA","2020-09-30","4.2","EM"
"7C4P","Protein/DNA","Crystal structure of DBD plasma treated zebrafish TRF2 myb-domain complexed with DNA","2021-05-26","2.0","X-ray"
"7C4Q","Protein/DNA","Crystal structure of DBD plasma treated zebrafish TRF2 myb-domain complexed with DNA","2021-05-26","2.5","X-ray"
"7C4R","Protein/DNA","Crystal structure of hydrogen peroxide treated zebrafish TRF2 complexed with DNA","2021-05-26","2.4","X-ray"
"7C97","Protein/DNA","Cryo-EM structure of an Escherichia coli RNAP-promoter open complex (RPo) with SspA","2020-08-12","3.7","EM"
"7C98","Protein/DNA","Human DMC1 post-synaptic complexes","2020-11-18","3.5","EM"
"7C99","Protein/DNA","Human DMC1 post-synaptic complexes with mismatched dsDNA","2020-11-18","3.4","EM"
"7C9A","Protein/DNA","Human RAD51 post-synaptic complexes mutant (V273P, D274G)","2020-11-18","3.4","EM"
"7C9C","Protein/DNA","Human DMC1 pre-synaptic complexes","2020-11-25","3.3","EM"
"7C9O","Protein/DNA","Crystal structure of DNA-bound CCT/NF-YB/YC complex (HD1CCT/GHD8/OsNF-YC2)","2020-09-09","2.5","X-ray"
"7CBY","Protein/DNA","Structure of FOXG1 DNA binding domain bound to DBE2 DNA site","2020-10-28","1.6","X-ray"
"7CC9","Protein/DNA","Sulfur binding domain of SprMcrA complexed with phosphorothioated DNA","2020-07-08","2.1","X-ray"
"7CCD","Protein/DNA","Sulfur binding domain of SprMcrA complexed with phosphorothioated DNA","2020-07-08","2.4","X-ray"
"7CCJ","Protein/DNA","Sulfur binding domain of SprMcrA complexed with phosphorothioated DNA","2020-07-08","3.3","X-ray"
"7CCQ","Protein/DNA","Structure of the 1:1 cGAS-nucleosome complex","2020-10-07","3.8","EM"
"7CCR","Protein/DNA","Structure of the 2:2 cGAS-nucleosome complex","2020-10-07","4.9","EM"
"7CD5","Protein/DNA","mAPE1-blunt-ended dsDNA product complex","2021-01-13","2.7","X-ray"
"7CD6","Protein/DNA","mAPE1-recessed dsDNA product complex","2021-01-13","2.7","X-ray"
"7CE1","Protein/DNA","Complex STRUCTURE OF TRANSCRIPTION FACTOR SghR with its COGNATE DNA","2020-07-15","3.2","X-ray"
"7CHW","Protein/DNA","Cryo-EM structure of an Escherichia coli RNAP-promoter open complex (RPo)","2020-08-12","3.6","EM"
"7CKQ","Protein/DNA","The cryo-EM structure of B. subtilis BmrR transcription activation complex","2020-12-16","4.4","EM"
"7CLI","Protein/DNA","Structure of NF-kB p52 homodimer bound to P-Selectin kB DNA fragment","2021-07-21","3.0","X-ray"
"7CO6","Protein/DNA","Binary complex of DNA polymerase Mu with 1-nt gapped DNA (templating thymine)","2021-06-30","1.9","X-ray"
"7CO8","Protein/DNA","Ternary complex of DNA polymerase Mu with 2-nt gapped DNA (T:dGMPNPP)","2021-06-30","1.7","X-ray"
"7CO9","Protein/DNA","Ternary complex of DNA polymerase Mu with 1-nt gapped DNA (T:dGMPNPP) and Mg","2021-06-30","1.6","X-ray"
"7COA","Protein/DNA","Ternary complex of DNA polymerase Mu with 1-nt gapped DNA (T:dGMPNPP) and Mn","2021-06-30","1.7","X-ray"
"7COB","Protein/DNA","Ternary complex of DNA polymerase Mu (Q441A) with 1-nt gapped DNA (T:dGMPNPP)","2021-06-30","1.8","X-ray"
"7COC","Protein/DNA","Ternary complex of DNA polymerase Mu (K438A/Q441A) with 1-nt gapped DNA (T:dGMPNPP)","2021-06-30","1.9","X-ray"
"7COD","Protein/DNA","Post insertion complex of DNA polymerase Mu (K438A/Q441A) with 1-nt gapped DNA","2021-06-30","1.8","X-ray"
"7COW","Protein/DNA","353 bp di-nucleosome harboring cohesive DNA termini with linker histone H1.0","2021-08-11","2.9","X-ray"
"7CPW","Protein/DNA","Complex structure of DNA with self-catalyzed depurination activity","2021-08-18","2.8","X-ray"
"7CQ4","Protein/DNA","Crystal structure of Slx1-Slx4 in complex with 5'flap DNA","2021-06-16","3.3","X-ray"
"7CR6","Protein/DNA","Synechocystis Cas1-Cas2/prespacer binary complex","2021-03-31","3.7","X-ray"
"7CR8","Protein/DNA","Synechocystis Cas1-Cas2-prespacerL complex","2021-03-31","3.7","X-ray"
"7CRE","Protein/DNA","hnRNPK KH3 domain in complex with a ssDNA fragment from the SIRLOIN element","2021-12-15","3.0","X-ray"
"7CRO","Protein/DNA","NSD2 bearing E1099K/T1150A dual mutation in complex with 187-bp NCP","2020-10-21","3.8","EM"
"7CRP","Protein/DNA","NSD3 bearing E1181K/T1232A dual mutation in complex with 187-bp NCP (1:1 binding mode)","2020-10-21","3.2","EM"
"7CRQ","Protein/DNA","NSD3 bearing E1181K/T1232A dual mutation in complex with 187-bp NCP (2:1 binding mode)","2020-10-21","3.1","EM"
"7CRR","Protein/DNA","Native NSD3 bound to 187-bp nucleosome","2020-10-21","3.5","EM"
"7CSW","Protein/DNA","Pseudomonas aeruginosa antitoxin HigA with pa2440 promoter","2021-01-13","2.0","X-ray"
"7CSY","Protein/DNA","Pseudomonas aeruginosa antitoxin HigA with higBA promoter","2021-01-13","2.3","X-ray"
"7CSZ","Protein/DNA","Crystal structure of the N-terminal tandem RRM domains of RBM45 in complex with single-stranded DNA","2021-02-03","1.8","X-ray"
"7CUH","Protein/DNA","Crystal structure of fission yeast Pot1 and ssDNA","2021-08-25","3.0","X-ray"
"7CVO","Protein/DNA","crystal structure of Arabidopsis CO CCT domain in complex with NF-YB3/YC4 and FT CORE2 DNA","2021-06-16","2.6","X-ray"
"7CVQ","Protein/DNA","crystal structure of Arabidopsis CO CCT domain in complex with NF-YB2/YC3 and FT CORE1 DNA","2021-06-16","3.3","X-ray"
"7CY6","Protein/DNA","Crystal Structure of CMD1 in complex with 5mC-DNA","2020-12-30","2.1","X-ray"
"7CY7","Protein/DNA","Crystal Structure of CMD1 in complex with DNA","2020-12-30","2.1","X-ray"
"7CY8","Protein/DNA","Crystal Structure of CMD1 in complex with 5mC-DNA and vitamin C","2020-12-30","2.4","X-ray"
"7D1Z","Protein/DNA","Cryo-EM structure of SET8-nucleosome complex","2021-02-10","3.1","EM"
"7D20","Protein/DNA","Cryo-EM structure of SET8-CENP-A-nucleosome complex","2021-02-10","3.0","EM"
"7D3T","Protein/DNA","Crystal structure of OSPHR2 in complex with DNA","2021-10-06","2.7","X-ray"
"7D3V","Protein/DNA","Non-specific and specific interactions work cooperatively to promote cytidine deamination catalyzed by APOBEC3A","2021-10-06","","NMR"
"7D3W","Protein/DNA","Non-specific and specific interactions work cooperatively to promote cytidine deamination catalyzed by APOBEC3A","2021-10-06","","NMR"
"7D3X","Protein/DNA","Non-specific and specific interactions work cooperatively to promote cytidine deamination catalyzed by APOBEC3A","2021-10-06","","NMR"
"7D69","Protein/DNA","Cryo-EM structure of the nucleosome containing Giardia histones","2021-09-08","3.6","EM"
"7D7C","Protein/DNA","CryoEM structure of gp55-dependent RNA polymerase-promoter open complex","2021-01-20","3.6","EM"
"7D7D","Protein/DNA","CryoEM structure of gp45-dependent transcription activation complex","2021-01-20","4.5","EM"
"7D8T","Protein/DNA","MITF bHLHLZ complex with M-box DNA","2021-10-13","3.2","X-ray"
"7D98","Protein/DNA","Crystal structure of full-length CbnR complexed with the target DNA complex","2021-03-10","3.6","X-ray"
"7DBH","Protein/DNA","The mouse nucleosome structure containing H3mm18","2022-01-19","3.6","EM"
"7DBM","Protein/DNA","HIV-1 reverse transcriptase mutant Q151M/Y115F/F116Y/M184V:DNA:dGTP ternary complex","2021-08-04","2.4","X-ray"
"7DBN","Protein/DNA","HIV-1 reverse transcriptase mutant Q151M/Y115F/F116Y/M184V/F160M:DNA:dCTP ternary complex","2021-08-04","2.7","X-ray"
"7DBP","Protein/DNA","Linker histone defines structure and self-association behaviour of the 177 bp human chromosome","2020-12-23","4.5","EM"
"7DCI","Protein/DNA","Crystal structure of HSF2 DNA-binding domain in complex with 2-site HSE DNA in the head-to-head orientation","2021-07-14","1.7","X-ray"
"7DCJ","Protein/DNA","Crystal structure of HSF1 DNA-binding domain in complex with 2-site HSE DNA in the head-to-head orientation","2021-07-14","2.0","X-ray"
"7DCS","Protein/DNA","Crystal structure of HSF1 DNA-binding domain in complex with 3-site HSE DNA (23 bp)","2021-07-14","2.4","X-ray"
"7DCT","Protein/DNA","Crystal structure of HSF1 DNA-binding domain in complex with 3-site HSE DNA (24 bp)","2021-07-14","2.4","X-ray"
"7DCU","Protein/DNA","Crystal structure of HSF2 DNA-binding domain in complex with 3-site HSE DNA (21 bp)","2021-07-14","1.8","X-ray"
"7DKG","Protein/DNA","Influenza H5N1 nucleoprotein (truncated) in complex with nucleotides","2021-04-14","3.0","X-ray"
"7DPE","Protein/DNA","RNA methyltransferase METTL4","2021-12-22","2.8","X-ray"
"7DQ0","Protein/DNA","Crystal structure of actinomycin D-echinomycin-d(ACGTGCT/AGCTCGT) complex","2021-12-29","2.0","X-ray"
"7DQ8","Protein/DNA","Crystal structure of actinomycin D-echinomycin-d(ACGCGCT/AGCTCGT) complex","2021-12-29","2.4","X-ray"
"7DTA","Protein/DNA","Solution structure of the C-clamp domain from human HDBP1 in complex with DNA","2021-07-21","","NMR"
"7DV2","Protein/DNA","Structure of Sulfolobus solfataricus SegB-DNA complex","2021-12-22","3.1","X-ray"
"7DVV","Protein/DNA","Heme sensor protein PefR from Streptococcus agalactiae bound to operator DNA (28-mer)","2021-09-29","2.5","X-ray"
"7DW5","Protein/DNA","Crystal structure of DUX4 HD1-HD2 domain complexed with ERG sites","2021-11-03","2.8","X-ray"
"7DWR","Protein/DNA","Structure of Sulfolobus solfataricus SegA-ADP complex bound to DNA","2021-12-22","2.8","X-ray"
"7DXP","Protein/DNA","Influenza H5N1 nucleoprotein in complex with nucleotides","2021-04-14","2.3","X-ray"
"7DY6","Protein/DNA","A refined cryo-EM structure of an Escherichia coli RNAP-promoter open complex (RPo) with SspA","2021-11-17","3.7","EM"
"7E1B","Protein/DNA","Crystal structure of VbrR-DNA complex","2022-02-09","4.6","X-ray"
"7E8D","Protein/DNA","NSD2 E1099K mutant bound to nucleosome","2021-11-10","2.8","EM"
"7E8I","Protein/DNA","Structural insight into BRCA1-BARD1 complex recruitment to damaged chromatin","2021-06-30","3.1","EM"
"7E9C","Protein/DNA","Cryo-EM structure of the 1:1 Orc1 BAH domain in complex with nucleosome","2022-09-07","3.5","EM"
"7E9F","Protein/DNA","Cryo-EM structure of the 2:1 Orc1 BAH domain in complex with nucleosome","2022-09-07","4.0","EM"
"7EA5","Protein/DNA","Yeast Set2 bound to a nucleosome containing oncohistone mutations","2021-07-14","3.3","EM"
"7EA8","Protein/DNA","Human SETD2 bound to a nucleosome containing oncohistone mutations","2021-07-14","3.1","EM"
