"ID","Polymer Composition","Entry Title","Release Date","Resolution (Å)","Method"
"5E5O","Protein/DNA","I-SmaMI bound to uncleaved DNA target in the presence of Calcium ions","2016-01-13","2.4","X-ray"
"5E5S","Protein/DNA","I-SmaMI K103A mutant","2016-01-13","2.3","X-ray"
"5E63","Protein/DNA","K262A mutant of I-SmaMI","2016-01-13","2.6","X-ray"
"5E67","Protein/DNA","K103A/K262A double mutant of I-SmaMI","2016-01-13","2.2","X-ray"
"5E69","Protein/DNA","Glucocorticoid receptor DNA binding domain - IL8 NF-kB response element complex","2017-02-08","1.9","X-ray"
"5E6A","Protein/DNA","Glucocorticoid receptor DNA binding domain - PLAU NF-kB response element complex","2017-02-08","2.2","X-ray"
"5E6B","Protein/DNA","Glucocorticoid receptor DNA binding domain - RELB NF-kB response element complex","2017-02-08","2.3","X-ray"
"5E6C","Protein/DNA","Glucocorticoid receptor DNA binding domain - CCL2 NF-kB response element complex","2017-02-08","2.2","X-ray"
"5E6D","Protein/DNA","Glucocorticoid receptor DNA binding domain - ICAM1 NF-kB response element complex","2017-02-08","2.4","X-ray"
"5E8I","Protein/DNA","Crystal structure of the DNA binding domain of human transcription factor FLI1 in complex with a 10-mer DNA ACCGGAAGTG","2015-12-09","3.5","X-ray"
"5EAN","Protein/DNA","Crystal structure of Dna2 in complex with a 5' overhang DNA","2015-11-18","2.4","X-ray"
"5EAX","Protein/DNA","Crystal structure of Dna2 in complex with an ssDNA","2015-11-18","3.0","X-ray"
"5ED4","Protein/DNA","Structure of a PhoP-DNA complex","2016-04-27","2.4","X-ray"
"5EDN","Protein/DNA","Structure of HOXB13-DNA(TCG) complex","2016-11-09","3.2","X-ray"
"5EDW","Protein/DNA","Ternary structure of Dpo4 bound to G in the template base paired with incoming dTTP","2016-11-02","2.6","X-ray"
"5EEA","Protein/DNA","Structure of HOXB13-DNA(CAA) complex","2016-10-26","2.2","X-ray"
"5EF6","Protein/DNA","Structure of HOXB13 complex with methylated DNA","2017-02-08","3.0","X-ray"
"5EG0","Protein/DNA","HOXB13-MEIS1 heterodimer bound to DNA","2016-11-09","3.1","X-ray"
"5EG6","Protein/DNA","CSL-RITA complex bound to DNA","2017-04-26","2.1","X-ray"
"5EGB","Protein/DNA","Human PRDM9 allele-A ZnF Domain with Associated Recombination Hotspot DNA Sequence II","2016-02-17","2.0","X-ray"
"5EGO","Protein/DNA","HOXB13-MEIS1 heterodimer bound to methylated DNA","2016-11-09","2.5","X-ray"
"5EH2","Protein/DNA","Human PRDM9 allele-A ZnF Domain with Associated Recombination Hotspot DNA Sequence III","2016-02-17","2.0","X-ray"
"5EI9","Protein/DNA","Human PRDM9 allele-A ZnF Domain with Associated Recombination Hotspot DNA Sequence I","2016-02-17","1.9","X-ray"
"5EIX","Protein/DNA","QUINOLONE-STABILIZED CLEAVAGE COMPLEX OF TOPOISOMERASE IV FROM KLEBSIELLA PNEUMONIAE","2016-04-13","3.4","X-ray"
"5EJK","Protein/DNA","Crystal structure of the Rous sarcoma virus intasome","2016-02-17","3.8","X-ray"
"5EMC","Protein/DNA","Transcription factor GRDBD and smGRE complex","2016-06-29","2.3","X-ray"
"5EMP","Protein/DNA","Transcription factor GRDBD and mmGRE complex","2016-06-29","2.3","X-ray"
"5EMQ","Protein/DNA","Transcription factor GRDBD and GRE complex","2016-06-29","2.3","X-ray"
"5EOZ","Protein/DNA","Mutagenicity of 7-Benzyl guanine lesion and Replication by Human DNA Polymerase beta","2016-11-23","2.1","X-ray"
"5ESP","Protein/DNA","Crystal Structure of LAGLIDADG Meganuclease I-PanMI with coordinated Calcium ions","2016-03-30","3.0","X-ray"
"5EW1","Protein/DNA","Human thrombin sandwiched between two DNA aptamers: HD22 and HD1-deltaT3","2016-11-30","3.0","X-ray"
"5EW2","Protein/DNA","Human thrombin sandwiched between two DNA aptamers: HD22 and HD1-deltaT12","2016-11-30","3.6","X-ray"
"5EWE","Protein/DNA","Ternary complex of human DNA polymerase eta inserting rCTP opposite template G","2016-01-13","1.7","X-ray"
"5EWF","Protein/DNA","Ternary complex of human DNA polymerase eta inserting rCTP opposite an 8-Oxodeoxyguanosine Lesion","2016-01-13","1.8","X-ray"
"5EWG","Protein/DNA","Ternary complex of human DNA polymerase eta inserting rATP opposite an 8-Oxodeoxyguanosine Lesion","2016-01-13","1.8","X-ray"
"5EXH","Protein/DNA","Crystal structure of mTET3-CXXC domain in complex with 5-carboxylcytosine DNA at 1.3 Angstroms resolution.","2016-02-03","1.3","X-ray"
"5EYB","Protein/DNA","X-ray Structure of Reb1-Ter Complex","2016-04-13","2.7","X-ray"
"5EYO","Protein/DNA","The crystal structure of the Max bHLH domain in complex with 5-carboxyl cytosine DNA","2016-12-14","2.4","X-ray"
"5F3W","Protein/DNA","Structure of the ATPrS-Mre11/Rad50-DNA complex","2016-03-02","3.1","X-ray"
"5F55","Protein/DNA","Structure of RecJ complexed with DNA","2016-06-15","2.6","X-ray"
"5F56","Protein/DNA","Structure of RecJ complexed with DNA and SSB-ct","2016-06-15","2.3","X-ray"
"5F7Q","Protein/DNA","ROK repressor Lmo0178 from Listeria monocytogenes bound to operator","2016-09-07","2.4","X-ray"
"5F8A","Protein/DNA","Crystal structure of the ternary EcoRV-DNA-Lu complex with uncleaved DNA substrate. Lanthanide binding to EcoRV-DNA complex inhibits cleavage.","2016-11-09","1.8","X-ray"
"5F99","Protein/DNA","X-ray Structure of the MMTV-A Nucleosome Core Particle","2016-02-03","2.6","X-ray"
"5F9L","Protein/DNA","CRYSTAL STRUCTURE OF HUMAN DNA POLYMERASE ETA INSERTING dAMPNPP ACROSS A DNA TEMPLATE CONTAINING 1,N2-ETHENODEOXYGUANOSINE LESION","2016-12-21","2.6","X-ray"
"5F9N","Protein/DNA","CRYSTAL STRUCTURE OF HUMAN DNA POLYMERASE ETA INSERTING dCMPNPP ACROSS A DNA TEMPLATE CONTAINING 1,N2-ETHENODEOXYGUANOSINE LESION","2016-12-21","2.2","X-ray"
"5FB2","Protein/DNA","S. aureus MepR F27L Mutant bound to oligodeoxyribonucleotide","2016-12-14","1.8","X-ray"
"5FD3","Protein/DNA","Structure of Lin54 tesmin domain bound to DNA","2016-08-03","2.4","X-ray"
"5FDK","Protein/DNA","Crystal structure of RecU(D88N) in complex with palindromic DNA duplex","2016-12-07","3.2","X-ray"
"5FF8","Protein/DNA","TDG enzyme-product complex","2016-09-28","1.7","X-ray"
"5FFJ","Protein/DNA","Structure of a nuclease-deletion mutant of the Type ISP restriction-modification enzyme LlaGI in complex with a DNA substrate mimic","2016-03-30","2.8","X-ray"
"5FGP","Protein/DNA","Crystal structure of D. melanogaster Pur-alpha repeat I-II in complex with DNA.","2016-01-20","2.0","X-ray"
"5FHD","Protein/DNA","Structure of Bacteroides sp Pif1 complexed with tailed dsDNA resulting in ssDNA bound complex","2016-03-30","2.0","X-ray"
"5FHE","Protein/DNA","Crystal structure of Bacteroides Pif1 bound to ssDNA","2016-03-30","2.9","X-ray"
"5FKV","Protein/DNA","cryo-EM structure of the E. coli replicative DNA polymerase complex bound to DNA (DNA polymerase III alpha, beta, epsilon, tau complex)","2015-11-25","8.0","EM"
"5FKW","Protein/DNA","cryo-EM structure of the E. coli replicative DNA polymerase complex bound to DNA (DNA polymerase III alpha, beta, epsilon)","2015-11-25","7.3","EM"
"5FLV","Protein/DNA","Crystal structure of NKX2-5 and TBX5 bound to the Nppa promoter region","2016-02-10","3.0","X-ray"
"5FMF","Protein/DNA","the P-lobe of RNA polymerase II pre-initiation complex","2015-11-25","6.0","EM"
"5FMP","Protein/DNA","KstR, transcriptional repressor of cholesterol degradation in Mycobacterium tuberculosis, bound to the DNA operator","2016-11-23","2.3","X-ray"
"5FRM","Protein/DNA","Crystal structure of the Prototype Foamy Virus (PFV) intasome in complex with magnesium and the INSTI XZ384 (compound 4a)","2016-02-17","2.6","X-ray"
"5FRN","Protein/DNA","Crystal structure of the Prototype Foamy Virus (PFV) intasome in complex with magnesium and the INSTI XZ419 (compound 4c)","2016-02-17","2.9","X-ray"
"5FRO","Protein/DNA","Crystal structure of the Prototype Foamy Virus (PFV) intasome in complex with magnesium and the INSTI XZ446 (compound 4f)","2016-02-17","2.7","X-ray"
"5FTE","Protein/DNA","Crystal structure of Pif1 helicase from Bacteroides in complex with ADP-AlF3 and ssDNA","2016-02-03","3.2","X-ray"
"5FUR","Protein/DNA","Structure of human TFIID-IIA bound to core promoter DNA","2016-04-06","8.5","EM"
"5FYW","Protein/DNA","Transcription initiation complex structures elucidate DNA opening (OC)","2016-05-18","4.3","EM"
"5FZ5","Protein/DNA","Transcription initiation complex structures elucidate DNA opening (CC)","2016-05-18","8.8","EM"
"5G32","Protein/DNA","Structure of Rad14 in complex with acetylaminophenyl-guanine containing DNA","2016-06-01","2.2","X-ray"
"5G33","Protein/DNA","Structure of Rad14 in complex with acetylnaphtyl-guanine containing DNA","2016-06-01","2.4","X-ray"
"5G34","Protein/DNA","Structure of Rad14 in complex with acetylaminoanthracene-C8-guanine containing DNA","2016-06-01","1.9","X-ray"
"5G35","Protein/DNA","Structure of Rad14 in complex with acetylaminopyren-C8-guanine containing DNA","2016-06-01","2.0","X-ray"
"5G5T","Protein/DNA","Structure of the Argonaute protein from Methanocaldcoccus janaschii in complex with guide DNA","2017-02-08","2.9","X-ray"
"5GAT","Protein/DNA","SOLUTION NMR STRUCTURE OF THE WILD TYPE DNA BINDING DOMAIN OF AREA COMPLEXED TO A 13BP DNA CONTAINING A CGATA SITE, 35 STRUCTURES","1998-01-28","","NMR"
"5GKE","Protein/DNA","Structure of EndoMS-dsDNA1 complex","2016-11-02","2.4","X-ray"
"5GKF","Protein/DNA","Structure of EndoMS-dsDNA1' complex","2016-11-02","2.8","X-ray"
"5GKG","Protein/DNA","Structure of EndoMS-dsDNA1'' complex","2016-11-02","2.6","X-ray"
"5GKH","Protein/DNA","Structure of EndoMS-dsDNA2 complex","2016-11-02","2.9","X-ray"
"5GKI","Protein/DNA","Structure of EndoMS-dsDNA3 complex","2016-11-02","2.9","X-ray"
"5GKP","Protein/DNA","Crystal structure of the EndoG worm homologue CPS-6 H148A/F122A in complex with DNA","2016-11-23","2.3","X-ray"
"5GKR","Protein/DNA","Crystal structure of SLE patient-derived anti-DNA antibody in complex with oligonucleotide","2017-07-05","2.1","X-ray"
"5GNJ","Protein/DNA","Structure of a transcription factor and DNA complex","2017-05-10","2.7","X-ray"
"5GPC","Protein/DNA","Structural analysis of fatty acid degradation regulator FadR from Bacillus halodurans","2017-03-01","2.8","X-ray"
"5GQ9","Protein/DNA","Crystal structure of Thermus thermophilus Argonaute in complex with g1C siDNA and DNA target","2017-08-09","2.7","X-ray"
"5GSE","Protein/DNA","Crystal structure of unusual nucleosome","2017-05-03","3.1","X-ray"
"5GSU","Protein/DNA","Crystal structure of nucleosome core particle consisting of human testis-specific histone variants, Th2A and Th2B","2017-02-15","3.1","X-ray"
"5GT0","Protein/DNA","Crystal structure of nucleosome complex with human testis-specific histone variants, Th2a","2017-02-15","2.8","X-ray"
"5GT3","Protein/DNA","Crystal structure of nucleosome particle in the presence of human testis-specific histone variant, hTh2b","2017-02-15","2.9","X-ray"
"5GTC","Protein/DNA","Crystal structure of complex between DMAP-SH conjugated with a Kaposi's sarcoma herpesvirus LANA peptide (5-15) and nucleosome core particle","2017-06-28","2.7","X-ray"
"5GWI","Protein/DNA","Structure of a Human topoisomerase IIbeta fragment in complex with DNA and E7873R","2017-08-23","2.7","X-ray"
"5GWJ","Protein/DNA","Structure of a Human topoisomerase IIbeta fragment in complex with DNA and E7873S","2017-08-23","2.6","X-ray"
"5GWK","Protein/DNA","Human topoisomerase IIalpha in complex with DNA and etoposide","2017-08-23","3.2","X-ray"
"5GXQ","Protein/DNA","The crystal structure of the nucleosome containing H3.6","2017-04-19","2.9","X-ray"
"5GZB","Protein/DNA","Crystal Structure of Transcription Factor TEAD4 in Complex with M-CAT DNA","2017-04-19","2.7","X-ray"
"5H1B","Protein/DNA","Human RAD51 presynaptic complex","2016-12-21","4.4","EM"
"5H1C","Protein/DNA","Human RAD51 post-synaptic complexes","2016-12-21","4.5","EM"
"5H3R","Protein/DNA","Crystal Structure of mutant MarR C80S from E.coli complexed with operator DNA","2017-08-02","2.7","X-ray"
"5H58","Protein/DNA","Structural and dynamics studies of the TetR family protein, CprB from Streptomyces coelicolor in complex with its biological operator sequence","2017-05-03","4.0","X-ray"
"5H8W","Protein/DNA","XPD mechanism","2016-01-13","2.2","X-ray"
"5HAW","Protein/DNA","structures of the NO factor SlmA bound to DNA and the cytoskeletal cell division protein FtsZ","2016-04-13","1.9","X-ray"
"5HBU","Protein/DNA","Structure of the E. coli nucleoid occlusion protein SlmA bound to DNA and the C-terminal tail of the cytoskeletal cell division protein FtsZ","2016-04-13","2.6","X-ray"
"5HCH","Protein/DNA","X-ray structure of a lectin-bound DNA duplex containing an unnatural phenanthrenyl pair","2016-03-02","2.9","X-ray"
"5HDN","Protein/DNA","Crystal structure of heat shock factor1-DBD complex with ds-DNA and TtT","2017-01-11","1.7","X-ray"
"5HF7","Protein/DNA","TDG enzyme-substrate complex","2016-09-28","1.5","X-ray"
"5HHH","Protein/DNA","Structure of human DNA polymerase beta Host-Guest complexed with the control G for N7-CBZ-platination","2017-01-18","2.4","X-ray"
"5HHI","Protein/DNA","Structure of human DNA polymerase beta Host-Guest complexed with CBZ-platinated N7-G","2017-01-18","2.5","X-ray"
"5HK3","Protein/DNA","Crystal structure of M. tuberculosis MazF-mt3 T52D-F62D mutant in complex with DNA","2017-01-18","1.6","X-ray"
"5HLF","Protein/DNA","STRUCTURE OF HIV-1 REVERSE TRANSCRIPTASE In COMPLEX WITH A 38-MER HAIRPIN TEMPLATE-PRIMER DNA APTAMER AND AN ALPHA-CARBOXYPHOSPHONATE INHIBITOR","2016-02-10","3.0","X-ray"
"5HLG","Protein/DNA","Structure of reduced AbfR bound to DNA","2017-01-25","3.0","X-ray"
"5HLH","Protein/DNA","Crystal structure of the overoxidized AbfR bound to DNA","2017-01-25","3.0","X-ray"
"5HLK","Protein/DNA","Crystal structure of the ternary EcoRV-DNA-Lu complex with cleaved DNA substrate.","2016-11-09","2.0","X-ray"
"5HLT","Protein/DNA","Crystal structure of pyrene- and phenanthrene-modified DNA in complex with the BpuJ1 endonuclease binding domain","2016-08-17","2.7","X-ray"
"5HNF","Protein/DNA","Crystal structure of pyrene- and phenanthrene-modified DNA in complex with the BpuJ1 endonuclease binding domain","2016-08-17","1.5","X-ray"
"5HNH","Protein/DNA","Crystal structure of pyrene- and phenanthrene-modified DNA in complex with the BpuJ1 endonuclease binding domain","2016-08-17","1.9","X-ray"
"5HNK","Protein/DNA","Crystal structure of T5Fen in complex intact substrate and metal ions.","2016-06-01","2.2","X-ray"
"5HOD","Protein/DNA","Structure of LHX4 transcription factor complexed with DNA","2017-02-01","2.7","X-ray"
"5HOO","Protein/DNA","Crystal structure of the Mos1 Strand Transfer Complex","2016-06-01","3.3","X-ray"
"5HP1","Protein/DNA","STRUCTURE OF HIV-1 REVERSE TRANSCRIPTASE In COMPLEX WITH A DNA aptamer and FOSCARNET, a Pyrophosphate analog","2016-06-01","2.9","X-ray"
"5HP4","Protein/DNA","Crystal structure bacteriohage T5 D15 flap endonuclease (D155K) pseudo-enzyme-product complex with DNA and metal ions","2016-06-01","1.9","X-ray"
"5HQ2","Protein/DNA","Structural model of Set8 histone H4 Lys20 methyltransferase bound to nucleosome core particle","2016-03-23","4.5","X-ray"
"5HR4","Protein/DNA","Structure of Type IIL restriction-modification enzyme MmeI in complex with DNA has implications for engineering of new specificities","2016-04-27","2.6","X-ray"
"5HR9","Protein/DNA","The crystal structure of Se-AsfvPolX(L52/163M mutant) in complex with 1nt-gap DNA1","2017-01-18","2.2","X-ray"
"5HRB","Protein/DNA","The crystal structure of AsfvPolX:DNA1 binary complex","2017-01-18","1.7","X-ray"
"5HRD","Protein/DNA","The crystal structure of AsfvPolX:DNA2 binary complex","2017-01-18","1.8","X-ray"
"5HRE","Protein/DNA","The crystal structure of AsfvPolX:DNA3 binary complex","2017-01-18","1.8","X-ray"
"5HRF","Protein/DNA","The crystal structure of AsfvPolX: DNA5: dGTP ternary complex","2017-01-18","2.3","X-ray"
"5HRG","Protein/DNA","The crystal structure of AsfvPolX(D51N mutant):DNA4 binary complex","2017-01-18","2.0","X-ray"
"5HRH","Protein/DNA","The crystal structure of AsfvPolX(H115F/R127A mutant): 1nt-gap(P) DNA2:dGTP ternary complex","2017-01-18","3.0","X-ray"
"5HRI","Protein/DNA","The crystal structure of AsfvPolX:DNA1 binary complex","2017-01-18","2.2","X-ray"
"5HRK","Protein/DNA","The crystal structure of AsfvPolX(H115F mutant): 1nt-gap(P) DNA2:dGTP ternary complex","2017-01-18","2.9","X-ray"
"5HRL","Protein/DNA","The crystal structure of AsfvPolX: 1nt-gap(P) DNA2: dGTP ternary complex.","2017-01-18","2.4","X-ray"
"5HRO","Protein/DNA","STRUCTURE OF HIV-1 REVERSE TRANSCRIPTASE In COMPLEX WITH A DNA aptamer and an Alpha-carboxy nucleoside phosphonate inhibitor (alpha-CNP)","2016-06-01","2.8","X-ray"
"5HRT","Protein/DNA","Crystal structure of mouse autotaxin in complex with a DNA aptamer","2016-04-06","2.0","X-ray"
"5HRU","Protein/DNA","Crystal structure of Plasmodium vivax LDH in complex with a DNA aptamer called pL1","2016-10-19","1.7","X-ray"
"5HSO","Protein/DNA","Crystal structure of MYCOBACTERIUM TUBERCULOSIS MARR FAMILY PROTEIN Rv2887 complex with DNA","2017-02-01","2.5","X-ray"
"5HT2","Protein/DNA","Mouse Tdp2 reaction product (5'-phosphorylated DNA)-Mg2+ complex with 1-N6-etheno-adenine","2016-04-27","1.4","X-ray"
"5HTO","Protein/DNA","Crystal structure of Plasmodium Vivax LDH in complex with a DNA aptamer called pL1 (tetrameric LDH in an asymmetric unit)","2016-10-19","1.9","X-ray"
"5I3U","Protein/DNA","STRUCTURE OF HIV-1 REVERSE TRANSCRIPTASE N-SITE COMPLEX; CATALYTIC INCORPORATION OF AZTMP to A DNA aptamer in CRYSTAL","2016-06-01","3.0","X-ray"
"5I42","Protein/DNA","Structure of HIV-1 Reverse Transcriptase in complex with a DNA aptamer, AZTTP, and CA(2+) ion","2016-06-01","3.3","X-ray"
"5I44","Protein/DNA","Structure of RacA-DNA complex; P21 form","2016-05-04","2.6","X-ray"
"5I50","Protein/DNA","Structure of OmoMYC bound to double-stranded DNA","2016-10-26","2.7","X-ray"
"5IFF","Protein/DNA","Crystal structure of R.PabI-nonspecific DNA complex","2016-11-23","1.9","X-ray"
"5III","Protein/DNA","Crystal structure of the pre-catalytic ternary complex of DNA polymerase lambda with a templating 8-oxo-dG and an incoming dATP","2016-08-17","1.8","X-ray"
"5IIJ","Protein/DNA","Crystal structure of the pre-catalytic ternary complex of DNA polymerase lambda with a templating 8-oxo-dG and an incoming dCTP","2016-08-17","1.7","X-ray"
"5IIK","Protein/DNA","Crystal structure of the post-catalytic nick complex of DNA polymerase lambda with a templating 8-oxo-dG and incorporated dC","2016-08-17","2.0","X-ray"
"5IIL","Protein/DNA","Crystal structure of the post-catalytic nick complex of DNA polymerase lambda with a templating 8-oxo-dG and incorporated dA","2016-08-17","2.0","X-ray"
"5IIM","Protein/DNA","Crystal structure of the pre-catalytic ternary extension complex of DNA polymerase lambda with an 8-oxo-dG:dA base-pair","2016-09-07","1.9","X-ray"
"5IIN","Protein/DNA","Crystal structure of the pre-catalytic ternary extension complex of DNA polymerase lambda with an 8-oxo-dG:dC base-pair","2016-08-17","2.1","X-ray"
"5IIO","Protein/DNA","Crystal structure of the DNA polymerase lambda binary complex","2016-08-17","2.1","X-ray"
"5INK","Protein/DNA","Mouse Tdp2 reaction product (5'-phosphorylated DNA)-abasic/THF-Mg2+ complex","2016-04-27","2.1","X-ray"
"5INL","Protein/DNA","Mouse Tdp2 reaction product (5'-phosphorylated DNA)-Mg2+ complex with deoxyadenosine","2016-04-27","1.6","X-ray"
"5INO","Protein/DNA","Human Tdp2 reaction product (5'-phosphorylated DNA)-Mg2+ complex","2016-04-27","3.2","X-ray"
"5INP","Protein/DNA","Mouse Tdp2 reaction product (5'-phosphorylated DNA)-Mn2+ complex","2016-04-27","1.9","X-ray"
"5INQ","Protein/DNA","Mouse Tdp2 reaction product (5'-phosphorylated DNA)-Ca2+ complex","2016-04-27","1.8","X-ray"
"5IP3","Protein/DNA","Tomato spotted wilt tospovirus nucleocapsid protein-ssDNA complex","2017-03-22","3.0","X-ray"
"5ITH","Protein/DNA","TIA-1 RRM2 recognition of target oligonucleotide","2017-02-22","2.3","X-ray"
"5ITR","Protein/DNA","Crystal Structure of Human NEIL1(P2G) bound to duplex DNA containing THF","2016-07-06","2.5","X-ray"
"5ITT","Protein/DNA","Crystal Structure of Human NEIL1 bound to duplex DNA containing THF","2016-07-06","2.5","X-ray"
"5ITU","Protein/DNA","Crystal Structure of Human NEIL1(242K) bound to duplex DNA containing THF","2016-07-06","2.4","X-ray"
"5ITX","Protein/DNA","Crystal Structure of Human NEIL1(P2G R242K) bound to duplex DNA containing Thymine Glycol","2016-07-06","2.6","X-ray"
"5ITY","Protein/DNA","Crystal Structure of Human NEIL1(P2G) bound to duplex DNA containing Thymine Glycol","2016-07-06","2.5","X-ray"
"5IUD","Protein/DNA","Human DNA polymerase alpha in binary complex with a DNA:DNA template-primer","2016-04-13","3.3","X-ray"
"5IVW","Protein/DNA","Human core TFIIH bound to DNA within the PIC","2016-05-18","10.0","EM"
"5IWI","Protein/DNA","1.98A structure of GSK945237 with S.aureus DNA gyrase and singly nicked DNA","2016-05-25","2.0","X-ray"
"5IWM","Protein/DNA","2.5A structure of GSK945237 with S.aureus DNA gyrase and DNA.","2016-05-25","2.5","X-ray"
"5IY6","Protein/DNA","Human holo-PIC in the closed state","2016-05-18","7.2","EM"
"5IY7","Protein/DNA","Human holo-PIC in the open state","2016-05-18","8.6","EM"
"5IY8","Protein/DNA","Human holo-PIC in the initial transcribing state","2016-05-18","7.9","EM"
"5IYA","Protein/DNA","Human core-PIC in the closed state","2016-05-18","5.4","EM"
"5IYB","Protein/DNA","Human core-PIC in the open state","2016-05-18","3.9","EM"
"5IYC","Protein/DNA","Human core-PIC in the initial transcribing state","2016-05-18","3.9","EM"
"5J0N","Protein/DNA","Lambda excision HJ intermediate","2017-02-08","11.0","EM"
"5J0O","Protein/DNA","Binary complex crystal structure of DNA polymerase Beta with A:A mismatch at the primer terminus","2016-10-26","2.0","X-ray"
"5J0P","Protein/DNA","Binary complex crystal structure of DNA polymerase Beta with A:C mismatch at the primer terminus","2016-10-26","2.2","X-ray"
"5J0Q","Protein/DNA","Binary complex crystal structure of DNA polymerase Beta with A:G mismatch at the primer terminus","2016-10-26","2.0","X-ray"
"5J0R","Protein/DNA","Binary complex crystal structure of DNA polymerase Beta with C:A mismatch at the primer terminus","2016-10-26","2.0","X-ray"
"5J0S","Protein/DNA","Binary complex crystal structure of DNA polymerase Beta with C:T mismatch at the primer terminus","2016-10-26","2.0","X-ray"
"5J0T","Protein/DNA","Binary complex crystal structure of DNA polymerase Beta with G:A mismatch at the primer terminus","2016-10-26","2.0","X-ray"
"5J0U","Protein/DNA","Binary complex crystal structure of DNA polymerase Beta with G:G mismatch at the primer terminus","2016-10-26","2.1","X-ray"
"5J0W","Protein/DNA","Binary complex crystal structure of DNA polymerase Beta with T:C mismatch at the primer terminus","2016-10-26","2.4","X-ray"
"5J0X","Protein/DNA","Binary complex crystal structure of DNA polymerase Beta with T:G mismatch at the primer terminus","2016-10-26","2.0","X-ray"
"5J0Y","Protein/DNA","Binary complex crystal structure of DNA polymerase Beta with T:T mismatch at the primer terminus","2016-10-26","2.0","X-ray"
"5J29","Protein/DNA","Ternary complex crystal structure of DNA polymerase Beta with A:A mismatch at the primer terminus","2016-10-26","2.2","X-ray"
"5J2A","Protein/DNA","Ternary complex crystal structure of DNA polymerase Beta with A:C mismatch at the primer terminus","2016-10-26","2.5","X-ray"
"5J2B","Protein/DNA","Ternary complex crystal structure of DNA polymerase Beta with A:C mismatch at the primer terminus","2016-10-26","2.5","X-ray"
"5J2C","Protein/DNA","Ternary complex crystal structure of DNA polymerase Beta with C:A mismatch at the primer terminus","2016-10-26","2.1","X-ray"
"5J2D","Protein/DNA","Ternary complex crystal structure of DNA polymerase Beta with C:C mismatch at the primer terminus","2016-10-26","2.1","X-ray"
"5J2E","Protein/DNA","Ternary complex crystal structure of DNA polymerase Beta with C:T mismatch at the primer terminus","2016-10-26","2.1","X-ray"
"5J2F","Protein/DNA","Ternary complex crystal structure of DNA polymerase Beta with G:A mismatch at the primer terminus","2016-10-26","2.1","X-ray"
"5J2G","Protein/DNA","Ternary complex crystal structure of DNA polymerase Beta with G:G mismatch at the primer terminus","2016-10-26","2.1","X-ray"
"5J2H","Protein/DNA","Ternary complex crystal structure of DNA polymerase Beta with G:T mismatch at the primer terminus","2016-10-26","2.3","X-ray"
"5J2I","Protein/DNA","Ternary complex crystal structure of DNA polymerase Beta with T:C mismatch at the primer terminus","2016-10-26","2.4","X-ray"
"5J2J","Protein/DNA","Ternary complex crystal structure of DNA polymerase Beta with T:G mismatch at the primer terminus","2016-10-26","2.2","X-ray"
"5J2K","Protein/DNA","Ternary complex crystal structure of DNA polymerase Beta with T:T mismatch at the primer terminus","2016-10-26","2.1","X-ray"
"5J2M","Protein/DNA","HIV-1 reverse transcriptase in complex with DNA and EFdA-triphosphate, a translocation-defective RT inhibitor","2016-08-03","2.4","X-ray"
"5J2N","Protein/DNA","HIV-1 reverse transcriptase in complex with DNA that has incorporated EFdA-MP at the P-(post-translocation) site and dTMP at the N-(pre-translocation) site","2016-08-03","2.9","X-ray"
"5J2P","Protein/DNA","HIV-1 reverse transcriptase in complex with DNA that has incorporated EFdA-MP at the P-(post-translocation) site and a second EFdA-MP at the N-(pre-translocation) site","2016-08-03","2.5","X-ray"
"5J2Q","Protein/DNA","HIV-1 reverse transcriptase in complex with DNA that has incorporated a mismatched EFdA-MP at the N-(pre-translocation) site","2016-08-03","2.8","X-ray"
"5J2Y","Protein/DNA","Molecular insight into the regulatory mechanism of the quorum-sensing repressor RsaL in Pseudomonas aeruginosa","2017-04-12","2.4","X-ray"
"5J37","Protein/DNA","Crystal structure of 60-mer BFDV Capsid Protein in complex with single stranded DNA","2016-05-04","2.3","X-ray"
"5J3E","Protein/DNA","Crystal Structure of Human THYN1 protein in complex with 5-methylcytosine containing DNA","2016-04-20","2.6","X-ray"
