"ID","Polymer Composition","Entry Title","Release Date","Resolution (Å)","Method"
"10MH","Protein/DNA","TERNARY STRUCTURE OF HHAI METHYLTRANSFERASE WITH ADOHCY AND HEMIMETHYLATED DNA CONTAINING 5,6-DIHYDRO-5-AZACYTOSINE AT THE TARGET","1999-02-09","2.5","X-ray"
"173D","Protein/DNA","MULTIPLE BINDING MODES OF ANTICANCER DRUG ACTINOMYCIN D: X-RAY, MOLECULAR MODELING, AND SPECTROSCOPIC STUDIES OF D(GAAGCTTC)2-ACTINOMYCIN D COMPLEXES AND ITS HOST DNA","1994-10-15","3.0","X-ray"
"185D","Protein/DNA","SEQUENCE SPECIFICITY OF QUINOXALINE ANTIBIOTICS. 1. SOLUTION STRUCTURE OF A 1:1 COMPLEX BETWEEN TRIOSTIN A AND [D(GACGTC)]2 AND COMPARISON WITH THE SOLUTION STRUCTURE OF THE [N-MECYS3, N-MECYS7]TANDEM-[D(GATATC)]2 COMPLEX","1995-02-07","","NMR"
"193D","Protein/DNA","SOLUTION STRUCTURE OF A QUINOMYCIN BISINTERCALATOR-DNA COMPLEX","1995-02-27","","NMR"
"1A02","Protein/DNA","STRUCTURE OF THE DNA BINDING DOMAINS OF NFAT, FOS AND JUN BOUND TO DNA","1998-05-27","2.7","X-ray"
"1A0A","Protein/DNA","PHOSPHATE SYSTEM POSITIVE REGULATORY PROTEIN PHO4/DNA COMPLEX","1998-03-18","2.8","X-ray"
"1A1F","Protein/DNA","DSNR (ZIF268 VARIANT) ZINC FINGER-DNA COMPLEX (GACC SITE)","1998-06-10","2.1","X-ray"
"1A1G","Protein/DNA","DSNR (ZIF268 VARIANT) ZINC FINGER-DNA COMPLEX (GCGT SITE)","1998-06-10","1.9","X-ray"
"1A1H","Protein/DNA","QGSR (ZIF268 VARIANT) ZINC FINGER-DNA COMPLEX (GCAC SITE)","1998-06-10","1.6","X-ray"
"1A1I","Protein/DNA","RADR (ZIF268 VARIANT) ZINC FINGER-DNA COMPLEX (GCAC SITE)","1998-06-17","1.6","X-ray"
"1A1J","Protein/DNA","RADR (ZIF268 VARIANT) ZINC FINGER-DNA COMPLEX (GCGT SITE)","1998-06-17","2.0","X-ray"
"1A1K","Protein/DNA","RADR (ZIF268 VARIANT) ZINC FINGER-DNA COMPLEX (GACC SITE)","1998-06-10","1.9","X-ray"
"1A1L","Protein/DNA","ZIF268 ZINC FINGER-DNA COMPLEX (GCAC SITE)","1998-06-17","2.3","X-ray"
"1A1V","Protein/DNA","HEPATITIS C VIRUS NS3 HELICASE DOMAIN COMPLEXED WITH SINGLE STRANDED SDNA","1999-01-13","2.2","X-ray"
"1A31","Protein/DNA","HUMAN RECONSTITUTED DNA TOPOISOMERASE I IN COVALENT COMPLEX WITH A 22 BASE PAIR DNA DUPLEX","1998-08-28","2.1","X-ray"
"1A35","Protein/DNA","HUMAN TOPOISOMERASE I/DNA COMPLEX","1998-08-28","2.5","X-ray"
"1A36","Protein/DNA","TOPOISOMERASE I/DNA COMPLEX","1998-08-12","2.8","X-ray"
"1A3Q","Protein/DNA","HUMAN NF-KAPPA-B P52 BOUND TO DNA","1998-06-11","2.1","X-ray"
"1A66","Protein/DNA","SOLUTION NMR STRUCTURE OF THE CORE NFATC1/DNA COMPLEX, 18 STRUCTURES","1998-06-17","","NMR"
"1A6B","Protein/DNA","NMR STRUCTURE OF THE COMPLEX BETWEEN THE ZINC FINGER PROTEIN NCP10 OF MOLONEY MURINE LEUKEMIA VIRUS AND A SEQUENCE OF THE PSI-PACKAGING DOMAIN OF HIV-1, 20 STRUCTURES","1999-08-23","","NMR"
"1A6Y","Protein/DNA","REVERBA ORPHAN NUCLEAR RECEPTOR/DNA COMPLEX","1998-10-21","2.3","X-ray"
"1A73","Protein/DNA","INTRON-ENCODED ENDONUCLEASE I-PPOI COMPLEXED WITH DNA","1998-10-14","1.8","X-ray"
"1A74","Protein/DNA","I-PPOL HOMING ENDONUCLEASE/DNA COMPLEX","1998-06-22","2.2","X-ray"
"1AAY","Protein/DNA","ZIF268 ZINC FINGER-DNA COMPLEX","1997-04-21","1.6","X-ray"
"1AHD","Protein/DNA","DETERMINATION OF THE NMR SOLUTION STRUCTURE OF AN ANTENNAPEDIA HOMEODOMAIN-DNA COMPLEX","1993-10-31","","NMR"
"1AIS","Protein/DNA","TATA-BINDING PROTEIN/TRANSCRIPTION FACTOR (II)B/TATA-BOX COMPLEX FROM PYROCOCCUS WOESEI","1997-07-07","2.1","X-ray"
"1AKH","Protein/DNA","MAT A1/ALPHA2/DNA TERNARY COMPLEX","1998-05-20","2.5","X-ray"
"1AM9","Protein/DNA","HUMAN SREBP-1A BOUND TO LDL RECEPTOR PROMOTER","1998-07-10","2.3","X-ray"
"1AN2","Protein/DNA","RECOGNITION BY MAX OF ITS COGNATE DNA THROUGH A DIMERIC B/HLH/Z DOMAIN","1997-09-17","2.9","X-ray"
"1AN4","Protein/DNA","STRUCTURE AND FUNCTION OF THE B/HLH/Z DOMAIN OF USF","1997-09-17","2.9","X-ray"
"1AOI","Protein/DNA","COMPLEX BETWEEN NUCLEOSOME CORE PARTICLE (H3,H4,H2A,H2B) AND 146 BP LONG DNA FRAGMENT","1998-09-30","2.8","X-ray"
"1APL","Protein/DNA","CRYSTAL STRUCTURE OF A MAT-ALPHA2 HOMEODOMAIN-OPERATOR COMPLEX SUGGESTS A GENERAL MODEL FOR HOMEODOMAIN-DNA INTERACTIONS","1993-10-21","2.7","X-ray"
"1AU7","Protein/DNA","PIT-1 MUTANT/DNA COMPLEX","1998-01-28","2.3","X-ray"
"1AWC","Protein/DNA","MOUSE GABP ALPHA/BETA DOMAIN BOUND TO DNA","1998-03-18","2.1","X-ray"
"1AZ0","Protein/DNA","ECORV ENDONUCLEASE/DNA COMPLEX","1998-06-19","2.0","X-ray"
"1AZP","Protein/DNA","HYPERTHERMOPHILE CHROMOSOMAL PROTEIN SAC7D BOUND WITH KINKED DNA DUPLEX","1999-01-13","1.6","X-ray"
"1AZQ","Protein/DNA","HYPERTHERMOPHILE CHROMOSOMAL PROTEIN SAC7D BOUND WITH KINKED DNA DUPLEX","1999-01-13","1.9","X-ray"
"1B01","Protein/DNA","TRANSCRIPTIONAL REPRESSOR COPG/DNA COMPLEX","1999-11-19","2.6","X-ray"
"1B3T","Protein/DNA","EBNA-1 NUCLEAR PROTEIN/DNA COMPLEX","1998-12-15","2.2","X-ray"
"1B69","Protein/DNA","THE SOLUTION STRUCTURE OF TN916 INTEGRASE N-TERMINAL DOMAIN/DNA COMPLEX","1999-09-29","","NMR"
"1B72","Protein/DNA","PBX1, HOMEOBOX PROTEIN HOX-B1/DNA TERNARY COMPLEX","1999-02-19","2.4","X-ray"
"1B8I","Protein/DNA","STRUCTURE OF THE HOMEOTIC UBX/EXD/DNA TERNARY COMPLEX","1999-04-12","2.4","X-ray"
"1B94","Protein/DNA","RESTRICTION ENDONUCLEASE ECORV WITH CALCIUM","1999-02-26","1.9","X-ray"
"1B95","Protein/DNA","ANALYSIS OF A MUTATIONAL HOT-SPOT IN THE ECORV RESTRICTION ENDONUCLEASE: A CATALYTIC ROLE FOR A MAIN CHAIN CARBONYL GROUP","1999-02-26","2.0","X-ray"
"1B96","Protein/DNA","ANALYSIS OF A MUTATIONAL HOT-SPOT IN THE ECORV RESTRICTION ENDONUCLEASE: A CATALYTIC ROLE FOR A MAIN CHAIN CARBONYL GROUP","1999-02-26","2.3","X-ray"
"1B97","Protein/DNA","ANALYSIS OF A MUTATIONAL HOT-SPOT IN THE ECORV RESTRICTION ENDONUCLEASE: A CATALYTIC ROLE FOR A MAIN CHAIN CARBONYL GROUP","1999-02-26","1.9","X-ray"
"1BBX","Protein/DNA","NON-SPECIFIC PROTEIN-DNA INTERACTIONS IN THE SSO7D-DNA COMPLEX, NMR, 1 STRUCTURE","1998-10-14","","NMR"
"1BC7","Protein/DNA","SERUM RESPONSE FACTOR ACCESSORY PROTEIN 1A (SAP-1)/DNA COMPLEX","1999-01-21","2.0","X-ray"
"1BC8","Protein/DNA","STRUCTURES OF SAP-1 BOUND TO DNA SEQUENCES FROM THE E74 AND C-FOS PROMOTERS PROVIDE INSIGHTS INTO HOW ETS PROTEINS DISCRIMINATE BETWEEN RELATED DNA TARGETS","1998-12-01","1.9","X-ray"
"1BDH","Protein/DNA","PURINE REPRESSOR MUTANT-HYPOXANTHINE-PALINDROMIC OPERATOR COMPLEX","1997-04-21","2.7","X-ray"
"1BDI","Protein/DNA","PURINE REPRESSOR MUTANT-HYPOXANTHINE-PALINDROMIC OPERATOR COMPLEX","1997-04-21","3.0","X-ray"
"1BDT","Protein/DNA","WILD TYPE GENE-REGULATING PROTEIN ARC/DNA COMPLEX","1999-02-16","2.5","X-ray"
"1BDV","Protein/DNA","ARC FV10 COCRYSTAL","1999-01-06","2.8","X-ray"
"1BDX","Protein/DNA","E. COLI DNA HELICASE RUVA WITH BOUND DNA HOLLIDAY JUNCTION, ALPHA CARBONS AND PHOSPHATE ATOMS ONLY","1999-11-24","6.0","X-ray"
"1BF4","Protein/DNA","CHROMOSOMAL DNA-BINDING PROTEIN SSO7D/D(GCGAACGC) COMPLEX","1999-11-10","1.6","X-ray"
"1BF5","Protein/DNA","TYROSINE PHOSPHORYLATED STAT-1/DNA COMPLEX","1998-08-12","2.9","X-ray"
"1BG1","Protein/DNA","TRANSCRIPTION FACTOR STAT3B/DNA COMPLEX","1999-01-13","2.3","X-ray"
"1BGB","Protein/DNA","ECORV ENDONUCLEASE COMPLEX WITH 5'-CGGGATATCCC DNA","1998-10-28","2.0","X-ray"
"1BHM","Protein/DNA","RESTRICTION ENDONUCLEASE BAMHI COMPLEX WITH DNA","1995-07-12","2.2","X-ray"
"1BJ6","Protein/DNA","1H NMR OF (12-53) NCP7/D(ACGCC) COMPLEX, 10 STRUCTURES","1999-02-02","","NMR"
"1BL0","Protein/DNA","MULTIPLE ANTIBIOTIC RESISTANCE PROTEIN (MARA)/DNA COMPLEX","1998-09-02","2.3","X-ray"
"1BNK","Protein/DNA","HUMAN 3-METHYLADENINE DNA GLYCOSYLASE COMPLEXED TO DNA","1998-10-21","2.7","X-ray"
"1BNZ","Protein/DNA","SSO7D HYPERTHERMOPHILE PROTEIN/DNA COMPLEX","1998-11-11","2.0","X-ray"
"1BP7","Protein/DNA","GROUP I MOBILE INTRON ENDONUCLEASE I-CREI COMPLEXED WITH HOMING SITE DNA","1999-01-06","3.0","X-ray"
"1BPX","Protein/DNA","DNA POLYMERASE BETA/DNA COMPLEX","1997-06-16","2.4","X-ray"
"1BPY","Protein/DNA","HUMAN DNA POLYMERASE BETA COMPLEXED WITH GAPPED DNA AND DDCTP","1997-06-16","2.2","X-ray"
"1BPZ","Protein/DNA","HUMAN DNA POLYMERASE BETA COMPLEXED WITH NICKED DNA","1997-06-16","2.6","X-ray"
"1BRN","Protein/DNA","SUBSITE BINDING IN AN RNASE: STRUCTURE OF A BARNASE-TETRANUCLEOTIDE COMPLEX AT 1.76 ANGSTROMS RESOLUTION","1994-01-31","1.8","X-ray"
"1BSS","Protein/DNA","ECORV-T93A/DNA/CA2+","1998-09-02","2.1","X-ray"
"1BSU","Protein/DNA","STRUCTURAL AND ENERGETIC ORIGINS OF INDIRECT READOUT IN SITE-SPECIFIC DNA CLEAVAGE BY A RESTRICTION ENDONUCLEASE","1998-09-09","2.0","X-ray"
"1BUA","Protein/DNA","STRUCTURAL AND ENERGETIC ORIGINS OF INDIRECT READOUT IN SITE-SPECIFIC DNA CLEAVAGE BY A RESTRICTION ENDONUCLEASE","1998-09-09","2.1","X-ray"
"1BVO","Protein/DNA","DORSAL HOMOLOGUE GAMBIF1 BOUND TO DNA","1999-07-12","2.7","X-ray"
"1BY4","Protein/DNA","STRUCTURE AND MECHANISM OF THE HOMODIMERIC ASSEMBLY OF THE RXR ON DNA","2000-01-12","2.1","X-ray"
"1C0W","Protein/DNA","CRYSTAL STRUCTURE OF THE COBALT-ACTIVATED DIPHTHERIA TOXIN REPRESSOR-DNA COMPLEX REVEALS A METAL BINDING SH-LIKE DOMAIN","2000-07-22","3.2","X-ray"
"1C7U","Protein/DNA","Complex of the DNA binding core domain of the transcription factor MEF2A with a 20mer oligonucleotide","2000-03-27","","NMR"
"1C7Y","Protein/DNA","E.COLI RUVA-HOLLIDAY JUNCTION COMPLEX","2000-07-21","3.1","X-ray"
"1C8C","Protein/DNA","CRYSTAL STRUCTURES OF THE CHROMOSOMAL PROTEINS SSO7D/SAC7D BOUND TO DNA CONTAINING T-G MISMATCHED BASE PAIRS","2001-05-04","1.4","X-ray"
"1C9B","Protein/DNA","CRYSTAL STRUCTURE OF A HUMAN TBP CORE DOMAIN-HUMAN TFIIB CORE DOMAIN COMPLEX BOUND TO AN EXTENDED, MODIFIED ADENOVIRAL MAJOR LATE PROMOTER (ADMLP)","2000-01-10","2.6","X-ray"
"1CA5","Protein/DNA","INTERCALATION SITE OF HYPERTHERMOPHILE CHROMOSOMAL PROTEIN SSO7D/SAC7D BOUND TO DNA","2000-02-23","2.2","X-ray"
"1CA6","Protein/DNA","INTERCALATION SITE OF HYPERTHERMOPHILE CHROMOSOMAL PROTEIN SSO7D/SAC7D BOUND TO DNA","2000-02-23","2.2","X-ray"
"1CBV","Protein/DNA","AN AUTOANTIBODY TO SINGLE-STRANDED DNA: COMPARISON OF THE THREE-DIMENSIONAL STRUCTURES OF THE UNLIGANDED FAB AND A DEOXYNUCLEOTIDE-FAB COMPLEX","1994-01-31","2.7","X-ray"
"1CDW","Protein/DNA","HUMAN TBP CORE DOMAIN COMPLEXED WITH DNA","1996-12-23","1.9","X-ray"
"1CEZ","Protein/DNA","CRYSTAL STRUCTURE OF A T7 RNA POLYMERASE-T7 PROMOTER COMPLEX","1999-05-21","2.4","X-ray"
"1CF7","Protein/DNA","STRUCTURAL BASIS OF DNA RECOGNITION BY THE HETERODIMERIC CELL CYCLE TRANSCRIPTION FACTOR E2F-DP","1999-04-02","2.6","X-ray"
"1CGP","Protein/DNA","CATABOLITE GENE ACTIVATOR PROTEIN (CAP)/DNA COMPLEX + ADENOSINE-3',5'-CYCLIC-MONOPHOSPHATE","1994-01-31","3.0","X-ray"
"1CIT","Protein/DNA","DNA-BINDING MECHANISM OF THE MONOMERIC ORPHAN NUCLEAR RECEPTOR NGFI-B","1999-05-03","2.7","X-ray"
"1CJG","Protein/DNA","NMR STRUCTURE OF LAC REPRESSOR HP62-DNA COMPLEX","2000-01-01","","NMR"
"1CKQ","Protein/DNA","PRE-TRANSITION STATE ECO RI ENDONUCLEASE/COGNATE DNA (TCGCGAATTCGCG) COMPLEX","1999-04-26","1.9","X-ray"
"1CKT","Protein/DNA","CRYSTAL STRUCTURE OF HMG1 DOMAIN A BOUND TO A CISPLATIN-MODIFIED DNA DUPLEX","1999-06-30","2.5","X-ray"
"1CL8","Protein/DNA","A PRE-TRANSITION STATE ECO RI ENDONUCLEASE/COGNATE DNA (TCGCGAPTTCGCG) COMPLEX WITH DNA BASE ANALOG PURINE (P)","1999-05-19","1.8","X-ray"
"1CLQ","Protein/DNA","CRYSTAL STRUCTURE OF A REPLICATION FORK DNA POLYMERASE EDITING COMPLEX AT 2.7 A RESOLUTION","1999-10-28","2.7","X-ray"
"1CMA","Protein/DNA","MET REPRESSOR/DNA COMPLEX + S-ADENOSYL-METHIONINE","1993-10-31","2.8","X-ray"
"1CO0","Protein/DNA","NMR STUDY OF TRP REPRESSOR-MTR OPERATOR DNA COMPLEX","2003-09-16","","NMR"
"1CQT","Protein/DNA","CRYSTAL STRUCTURE OF A TERNARY COMPLEX CONTAINING AN OCA-B PEPTIDE, THE OCT-1 POU DOMAIN, AND AN OCTAMER ELEMENT","1999-11-15","3.2","X-ray"
"1CRX","Protein/DNA","CRE RECOMBINASE/DNA COMPLEX REACTION INTERMEDIATE I","1998-10-14","2.4","X-ray"
"1CW0","Protein/DNA","CRYSTAL STRUCTURE ANALYSIS OF VERY SHORT PATCH REPAIR (VSR) ENDONUCLEASE IN COMPLEX WITH A DUPLEX DNA","1999-12-12","2.3","X-ray"
"1CYQ","Protein/DNA","INTRON ENCODED HOMING ENDONUCLEASE I-PPOI (H98A)/DNA HOMING SITE COMPLEX","1999-11-19","1.9","X-ray"
"1CZ0","Protein/DNA","INTRON ENCODED HOMING ENDONUCLEASE I-PPOI/DNA COMPLEX LACKING CATALYTIC METAL ION","1999-11-19","2.1","X-ray"
"1D02","Protein/DNA","CRYSTAL STRUCTURE OF MUNI RESTRICTION ENDONUCLEASE IN COMPLEX WITH COGNATE DNA","2000-03-08","1.7","X-ray"
"1D0E","Protein/DNA","CRYSTAL STRUCTURES OF THE N-TERMINAL FRAGMENT FROM MOLONEY MURINE LEUKEMIA VIRUS REVERSE TRANSCRIPTASE COMPLEXED WITH NUCLEIC ACID: FUNCTIONAL IMPLICATIONS FOR TEMPLATE-PRIMER BINDING TO THE FINGERS DOMAIN","2000-04-04","3.0","X-ray"
"1D1U","Protein/DNA","USE OF AN N-TERMINAL FRAGMENT FROM MOLONEY MURINE LEUKEMIA VIRUS REVERSE TRANSCRIPTASE TO FACILITATE CRYSTALLIZATION AND ANALYSIS OF A PSEUDO-16-MER DNA MOLECULE CONTAINING G-A MISPAIRS","2000-04-02","2.3","X-ray"
"1D2I","Protein/DNA","CRYSTAL STRUCTURE OF RESTRICTION ENDONUCLEASE BGLII COMPLEXED WITH DNA 16-MER","2000-02-21","1.7","X-ray"
"1D3U","Protein/DNA","TATA-BINDING PROTEIN/TRANSCRIPTION FACTOR (II)B/BRE+TATA-BOX COMPLEX FROM PYROCOCCUS WOESEI","1999-11-15","2.4","X-ray"
"1D5Y","Protein/DNA","CRYSTAL STRUCTURE OF THE E. COLI ROB TRANSCRIPTION FACTOR IN COMPLEX WITH DNA","2000-04-24","2.7","X-ray"
"1D66","Protein/DNA","DNA RECOGNITION BY GAL4: STRUCTURE OF A PROTEIN/DNA COMPLEX","1992-03-06","2.7","X-ray"
"1D8Y","Protein/DNA","CRYSTAL STRUCTURE OF THE COMPLEX OF DNA POLYMERASE I KLENOW FRAGMENT WITH DNA","1999-12-02","2.1","X-ray"
"1DC1","Protein/DNA","RESTRICTION ENZYME BSOBI/DNA COMPLEX STRUCTURE: ENCIRCLEMENT OF THE DNA AND HISTIDINE-CATALYZED HYDROLYSIS WITHIN A CANONICAL RESTRICTION ENZYME FOLD","2001-02-21","1.7","X-ray"
"1DCT","Protein/DNA","DNA (CYTOSINE-5) METHYLASE FROM HAEIII COVALENTLY BOUND TO DNA","1995-09-15","2.8","X-ray"
"1DDN","Protein/DNA","DIPHTHERIA TOX REPRESSOR (C102D MUTANT)/TOX DNA OPERATOR COMPLEX","1998-10-14","3.0","X-ray"
"1DE8","Protein/DNA","HUMAN APURINIC/APYRIMIDINIC ENDONUCLEASE-1 (APE1) BOUND TO ABASIC DNA","2000-02-02","3.0","X-ray"
"1DE9","Protein/DNA","HUMAN APE1 ENDONUCLEASE WITH BOUND ABASIC DNA AND MN2+ ION","2000-02-02","3.0","X-ray"
"1DEW","Protein/DNA","CRYSTAL STRUCTURE OF HUMAN APE1 BOUND TO ABASIC DNA","2000-02-02","2.6","X-ray"
"1DFM","Protein/DNA","Crystal structure of restriction endonuclease BGLII complexed with DNA 16-mer","2000-02-21","1.5","X-ray"
"1DGC","Protein/DNA","THE X-RAY STRUCTURE OF THE GCN4-BZIP BOUND TO ATF/CREB SITE DNA SHOWS THE COMPLEX DEPENDS ON DNA FLEXIBILITY","1994-06-22","3.0","X-ray"
"1DH3","Protein/DNA","CRYSTAL STRUCTURE OF A CREB BZIP-CRE COMPLEX REVEALS THE BASIS FOR CREB FAIMLY SELECTIVE DIMERIZATION AND DNA BINDING","2000-11-27","3.0","X-ray"
"1DIZ","Protein/DNA","CRYSTAL STRUCTURE OF E. COLI 3-METHYLADENINE DNA GLYCOSYLASE (ALKA) COMPLEXED WITH DNA","2000-03-20","2.5","X-ray"
"1DMU","Protein/DNA","Crystal structure of the restriction endonuclease BglI (e.c.3.1.21.4) bound to its dna recognition sequence","1999-12-18","2.2","X-ray"
"1DNK","Protein/DNA","THE X-RAY STRUCTURE OF THE DNASE I-D(GGTATACC)2 COMPLEX AT 2.3 ANGSTROMS RESOLUTION","1994-01-31","2.3","X-ray"
"1DP7","Protein/DNA","COCRYSTAL STRUCTURE OF RFX-DBD IN COMPLEX WITH ITS COGNATE X-BOX BINDING SITE","2000-03-06","1.5","X-ray"
"1DRG","Protein/DNA","CRYSTAL STRUCTURE OF TRIMERIC CRE RECOMBINASE-LOX COMPLEX","2001-10-19","2.5","X-ray"
"1DSC","Protein/DNA","NMR STUDY OF DNA (5'-D(*GP*AP*AP*GP*CP*TP*TP*C)-3') SELF-COMPLEMENTARY DUPLEX COMPLEXED WITH ACTINOMYCIN D, MINIMIZED AVERAGE STRUCTURE","1996-12-07","","NMR"
"1DSD","Protein/DNA","NMR STUDY OF DNA (5'-D(*GP*AP*TP*GP*CP*TP*TP*C)-3') T:T MISMATCHED DUPLEX COMPLEXED WITH ACTINOMYCIN D, MINIMIZED AVERAGE STRUCTURE","1996-12-07","","NMR"
"1DSZ","Protein/DNA","STRUCTURE OF THE RXR/RAR DNA-BINDING DOMAIN HETERODIMER IN COMPLEX WITH THE RETINOIC ACID RESPONSE ELEMENT DR1","2000-07-10","1.7","X-ray"
"1DU0","Protein/DNA","ENGRAILED HOMEODOMAIN Q50A VARIANT DNA COMPLEX","2000-07-31","2.0","X-ray"
"1DUX","Protein/DNA","ELK-1/DNA STRUCTURE REVEALS HOW RESIDUES DISTAL FROM DNA-BINDING SURFACE AFFECT DNA-RECOGNITION","2000-04-17","2.1","X-ray"
"1E3M","Protein/DNA","The crystal structure of E. coli MutS binding to DNA with a G:T mismatch","2000-11-01","2.2","X-ray"
"1E3O","Protein/DNA","Crystal structure of Oct-1 POU dimer bound to MORE","2001-11-10","1.9","X-ray"
"1E7J","Protein/DNA","HMG-D complexed to a bulge DNA","2001-03-05","","NMR"
"1EA4","Protein/DNA","TRANSCRIPTIONAL REPRESSOR COPG/22bp dsDNA COMPLEX","2001-07-05","3.0","X-ray"
"1EBM","Protein/DNA","CRYSTAL STRUCTURE OF THE HUMAN 8-OXOGUANINE GLYCOSYLASE (HOGG1) BOUND TO A SUBSTRATE OLIGONUCLEOTIDE","2000-03-20","2.1","X-ray"
"1ECR","Protein/DNA","ESCHERICHIA COLI REPLICATION TERMINATOR PROTEIN (TUS) COMPLEXED WITH DNA","1997-09-05","2.7","X-ray"
"1EFA","Protein/DNA","CRYSTAL STRUCTURE OF THE LAC REPRESSOR DIMER BOUND TO OPERATOR AND THE ANTI-INDUCER ONPF","2000-03-06","2.6","X-ray"
"1EGW","Protein/DNA","CRYSTAL STRUCTURE OF MEF2A CORE BOUND TO DNA","2000-03-20","1.5","X-ray"
"1EHL","Protein/DNA","64M-2 ANTIBODY FAB COMPLEXED WITH D(5HT)(6-4)T","2001-02-21","2.4","X-ray"
"1EJ9","Protein/DNA","CRYSTAL STRUCTURE OF HUMAN TOPOISOMERASE I DNA COMPLEX","2000-08-03","2.6","X-ray"
"1EMH","Protein/DNA","CRYSTAL STRUCTURE OF HUMAN URACIL-DNA GLYCOSYLASE BOUND TO UNCLEAVED SUBSTRATE-CONTAINING DNA","2000-05-16","1.8","X-ray"
"1EMJ","Protein/DNA","URACIL-DNA GLYCOSYLASE BOUND TO DNA CONTAINING A 4'-THIO-2'DEOXYURIDINE ANALOG PRODUCT","2000-05-16","2.0","X-ray"
"1EO3","Protein/DNA","INHIBITION OF ECORV ENDONUCLEASE BY DEOXYRIBO-3'-S-PHOSPHOROTHIOLATES: A HIGH RESOLUTION X-RAY CRYSTALLOGRAPHIC STUDY","2000-04-04","2.0","X-ray"
"1EO4","Protein/DNA","ECORV BOUND TO MN2+ AND COGNATE DNA CONTAINING A 3'S SUBSTITION AT THE CLEAVAGE SITE","2000-04-04","1.9","X-ray"
"1EON","Protein/DNA","ECORV BOUND TO 3'-S-PHOSPHOROTHIOLATE DNA AND CA2+","2000-04-04","1.6","X-ray"
"1EOO","Protein/DNA","ECORV BOUND TO COGNATE DNA","2000-04-04","2.2","X-ray"
"1EOP","Protein/DNA","ECORV BOUND TO COGNATE DNA","2000-04-04","2.6","X-ray"
"1EQZ","Protein/DNA","X-RAY STRUCTURE OF THE NUCLEOSOME CORE PARTICLE AT 2.5 A RESOLUTION","2000-04-17","2.5","X-ray"
"1ERI","Protein/DNA","X-RAY STRUCTURE OF THE DNA-ECO RI ENDONUCLEASE-DNA RECOGNITION COMPLEX: THE RECOGNITION NETWORK AND THE INTEGRATION OF RECOGNITION AND CLEAVAGE","1995-02-07","2.5","X-ray"
"1ESG","Protein/DNA","RESTRICTION ENDONUCLEASE BAMHI BOUND TO A NON-SPECIFIC DNA.","2000-05-31","1.9","X-ray"
"1EVW","Protein/DNA","L116A MUTANT OF THE HOMING ENDONUCLEASE I-PPOI COMPLEXED TO HOMING SITE DNA.","2000-08-03","3.1","X-ray"
"1EW1","Protein/DNA","RECA PROTEIN-BOUND SINGLE-STRANDED DNA","2000-05-08","","NMR"
"1EWN","Protein/DNA","CRYSTAL STRUCTURE OF THE HUMAN AAG DNA REPAIR GLYCOSYLASE COMPLEXED WITH 1,N6-ETHENOADENINE-DNA","2000-12-11","2.1","X-ray"
"1EWQ","Protein/DNA","CRYSTAL STRUCTURE TAQ MUTS COMPLEXED WITH A HETERODUPLEX DNA AT 2.2 A RESOLUTION","2000-10-23","2.2","X-ray"
"1EXI","Protein/DNA","CRYSTAL STRUCTURE OF TRANSCRIPTION ACTIVATOR BMRR, FROM B. SUBTILIS, BOUND TO 21 BASE PAIR BMR OPERATOR AND TPSB","2001-01-24","3.1","X-ray"
"1EXJ","Protein/DNA","CRYSTAL STRUCTURE OF TRANSCRIPTION ACTIVATOR BMRR, FROM B. SUBTILIS, BOUND TO 21 BASE PAIR BMR OPERATOR AND TPP","2001-01-24","3.0","X-ray"
"1EYG","Protein/DNA","Crystal structure of chymotryptic fragment of E. coli ssb bound to two 35-mer single strand DNAS","2000-08-01","2.8","X-ray"
"1EYU","Protein/DNA","HIGH RESOLUTION STRUCTURE OF THE PVUII ENDONCULEASE/COGNATE DNA COMPLEX AT PH 4.6","2000-07-21","1.8","X-ray"
"1F0O","Protein/DNA","PVUII ENDONUCLEASE/COGNATE DNA COMPLEX (GLUTARALDEHYDE-CROSSLINKED CRYSTAL) AT PH 7.5 WITH TWO CALCIUM IONS AT EACH ACTIVE SITE","2000-11-06","2.5","X-ray"
"1F0V","Protein/DNA","Crystal structure of an Rnase A dimer displaying a new type of 3D domain swapping","2001-02-21","1.7","X-ray"
"1F2I","Protein/DNA","COCRYSTAL STRUCTURE OF SELECTED ZINC FINGER DIMER BOUND TO DNA","2001-09-14","2.4","X-ray"
"1F44","Protein/DNA","CRYSTAL STRUCTURE OF TRIMERIC CRE RECOMBINASE-LOX COMPLEX","2001-10-12","2.0","X-ray"
"1F4K","Protein/DNA","CRYSTAL STRUCTURE OF THE REPLICATION TERMINATOR PROTEIN/B-SITE DNA COMPLEX","2001-06-08","2.5","X-ray"
"1F4R","Protein/DNA","CRYSTAL STRUCTURE OF THE HUMAN AAG DNA REPAIR GLYCOSYLASE COMPLEXED WITH 1,N6-ETHENOADENINE-DNA","2000-12-11","2.4","X-ray"
"1F4S","Protein/DNA","STRUCTURE OF TRANSCRIPTIONAL FACTOR ALCR IN COMPLEX WITH A TARGET DNA","2001-09-28","","NMR"
"1F5E","Protein/DNA","STRUCTURE OF TRANSCRIPTIONAL FACTOR ALCR IN COMPLEX WITH A TARGET DNA","2001-09-28","","NMR"
"1F5T","Protein/DNA","DIPHTHERIA TOX REPRESSOR (C102D MUTANT) COMPLEXED WITH NICKEL AND DTXR CONSENSUS BINDING SEQUENCE","2000-09-25","3.0","X-ray"
"1F66","Protein/DNA","2.6 A CRYSTAL STRUCTURE OF A NUCLEOSOME CORE PARTICLE CONTAINING THE VARIANT HISTONE H2A.Z","2000-11-27","2.6","X-ray"
"1F6O","Protein/DNA","CRYSTAL STRUCTURE OF THE HUMAN AAG DNA REPAIR GLYCOSYLASE COMPLEXED WITH DNA","2000-12-11","2.4","X-ray"
"1FIU","Protein/DNA","TETRAMERIC RESTRICTION ENDONUCLEASE NGOMIV IN COMPLEX WITH CLEAVED DNA","2001-02-07","1.6","X-ray"
"1FJA","Protein/DNA","NMR STUDY OF DEOXYRIBONUCLEIC ACID COMPLEXED WITH ACTINOMYCIN D","1996-06-10","","NMR"
"1FJL","Protein/DNA","HOMEODOMAIN FROM THE DROSOPHILA PAIRED PROTEIN BOUND TO A DNA OLIGONUCLEOTIDE","1996-06-20","2.0","X-ray"
"1FJX","Protein/DNA","STRUCTURE OF TERNARY COMPLEX OF HHAI METHYLTRANSFERASE MUTANT (T250G) IN COMPLEX WITH DNA AND ADOHCY","2000-12-15","2.3","X-ray"
"1FLO","Protein/DNA","FLP Recombinase-Holliday Junction Complex I","2000-09-04","2.6","X-ray"
"1FN7","Protein/DNA","COUPLING OF DAMAGE RECOGNITION AND CATALYSIS BY A HUMAN BASE-EXCISION DNA REPAIR PROTEIN","2001-04-21","2.6","X-ray"
"1FOK","Protein/DNA","STRUCTURE OF RESTRICTION ENDONUCLEASE FOKI BOUND TO DNA","1997-12-03","2.8","X-ray"
"1FOS","Protein/DNA","TWO HUMAN C-FOS:C-JUN:DNA COMPLEXES","1995-07-10","3.0","X-ray"
"1FW6","Protein/DNA","CRYSTAL STRUCTURE OF A TAQ MUTS-DNA-ADP TERNARY COMPLEX","2001-02-19","2.7","X-ray"
"1FYK","Protein/DNA","SERENDIPITOUS CRYSTAL STRUCTURE CONTAINING THE HEAT SHOCK TRANSCRIPTION FACTOR'S DNA BINDING DOMAIN AND COGNATE DNA THAT IS TRANSLATIONALLY DISORDERED","2001-09-28","2.5","X-ray"
"1FYL","Protein/DNA","SERENDIPITOUS CRYSTAL STRUCTURE CONTAINING THE HEAT SHOCK TRANSCRIPTION FACTOR'S DNA BINDING DOMAIN AND COGNATE DNA IN A HEAD-TO-HEAD ORIENTATION","2001-09-28","2.1","X-ray"
"1FYM","Protein/DNA","SERENDIPITOUS CRYSTAL STRUCTURE CONTAINING THE HEAT SHOCK TRANSCRIPTION FACTOR'S DNA BINDING DOMAIN AND COGNATE DNA IN A TAIL-TO-TAIL ORIENTATION","2001-09-28","2.2","X-ray"
"1G2D","Protein/DNA","STRUCTURE OF A CYS2HIS2 ZINC FINGER/TATA BOX COMPLEX (CLONE #2)","2001-09-07","2.2","X-ray"
"1G2F","Protein/DNA","STRUCTURE OF A CYS2HIS2 ZINC FINGER/TATA BOX COMPLEX (TATAZF;CLONE #6)","2001-09-07","2.0","X-ray"
"1G38","Protein/DNA","ADENINE-SPECIFIC METHYLTRANSFERASE M. TAQ I/DNA COMPLEX","2001-03-05","2.0","X-ray"
"1G3X","Protein/DNA","INTERCALATION OF AN 9ACRIDINE-PEPTIDE DRUG IN A DNA DODECAMER","2002-08-16","2.7","X-ray"
"1G4D","Protein/DNA","NMR STRUCTURE OF THE MU BACTERIOPHAGE REPRESSOR DNA-BINDING DOMAIN/DNA COMPLEX","2000-11-08","","NMR"
"1G9Y","Protein/DNA","HOMING ENDONUCLEASE I-CREI / DNA SUBSTRATE COMPLEX WITH CALCIUM","2001-04-02","2.0","X-ray"
"1G9Z","Protein/DNA","LAGLIDADG HOMING ENDONUCLEASE I-CREI / DNA PRODUCT COMPLEX WITH MAGNESIUM","2001-04-02","1.8","X-ray"
"1GA5","Protein/DNA","CRYSTAL STRUCTURE OF THE ORPHAN NUCLEAR RECEPTOR REV-ERB(ALPHA) DNA-BINDING DOMAIN BOUND TO ITS COGNATE RESPONSE ELEMENT","2001-11-16","2.4","X-ray"
"1GAT","Protein/DNA","SOLUTION STRUCTURE OF THE SPECIFIC DNA COMPLEX OF THE ZINC CONTAINING DNA BINDING DOMAIN OF THE ERYTHROID TRANSCRIPTION FACTOR GATA-1 BY MULTIDIMENSIONAL NMR","1993-10-31","","NMR"
"1GAU","Protein/DNA","SOLUTION STRUCTURE OF THE SPECIFIC DNA COMPLEX OF THE ZINC CONTAINING DNA BINDING DOMAIN OF THE ERYTHROID TRANSCRIPTION FACTOR GATA-1 BY MULTIDIMENSIONAL NMR","1993-10-31","","NMR"
"1GCC","Protein/DNA","SOLUTION NMR STRUCTURE OF THE COMPLEX OF GCC-BOX BINDING DOMAIN OF ATERF1 AND GCC-BOX DNA, MINIMIZED AVERAGE STRUCTURE","1999-03-23","","NMR"
"1GD2","Protein/DNA","CRYSTAL STRUCTURE OF BZIP TRANSCRIPTION FACTOR PAP1 BOUND TO DNA","2000-10-02","2.0","X-ray"
"1GDT","Protein/DNA","CRYSTAL STRUCTURE OF A SITE-SPECIFIC RECOMBINASE, GAMMA-DELTA RESOLVASE COMPLEXED WITH A 34 BP CLEAVAGE SITE","1996-04-03","3.0","X-ray"
"1GJI","Protein/DNA","Crystal structure of c-Rel bound to DNA","2002-05-30","2.9","X-ray"
"1GLU","Protein/DNA","CRYSTALLOGRAPHIC ANALYSIS OF THE INTERACTION OF THE GLUCOCORTICOID RECEPTOR WITH DNA","1994-01-31","2.9","X-ray"
"1GM5","Protein/DNA","Structure of RecG bound to three-way DNA junction","2001-10-03","3.2","X-ray"
"1GT0","Protein/DNA","Crystal structure of a POU/HMG/DNA ternary complex","2003-01-30","2.6","X-ray"
"1GTW","Protein/DNA","crystal structure of C/EBPbeta bZip homodimer bound to a DNA fragment from the tom-1A promoter","2004-02-06","1.9","X-ray"
"1GU4","Protein/DNA","Crystal structure of C/EBPBETA BZIP homodimer bound to a high affinity DNA fragment","2003-06-26","1.8","X-ray"
"1GU5","Protein/DNA","Crystal structure of C/EBPBETA BZIP homodimer bound to a DNA fragment from the MIM-1 promoter","2003-06-26","2.1","X-ray"
"1GXP","Protein/DNA","PhoB effector domain in complex with pho box DNA.","2002-04-29","2.5","X-ray"
"1H0M","Protein/DNA","Three-dimensional structure of the quorum sensing protein TraR bound to its autoinducer and to its target DNA","2002-08-29","3.0","X-ray"
"1H6F","Protein/DNA","Human TBX3, a transcription factor responsible for ulnar-mammary syndrome, bound to a palindromic DNA site","2002-04-19","1.7","X-ray"
"1H88","Protein/DNA","CRYSTAL STRUCTURE OF TERNARY PROTEIN-DNA COMPLEX1","2002-01-28","2.8","X-ray"
"1H89","Protein/DNA","CRYSTAL STRUCTURE OF TERNARY PROTEIN-DNA COMPLEX2","2002-01-28","2.5","X-ray"
"1H8A","Protein/DNA","CRYSTAL STRUCTURE OF TERNARY PROTEIN-DNA COMPLEX3","2002-01-28","2.2","X-ray"
"1H9D","Protein/DNA","Aml1/cbf-beta/dna complex","2001-03-31","2.6","X-ray"
